A2: WGC & District Billiards and Snooker League
A3: Snooker Singles Championship
B5: =D5&"+" -> Round 1+ | D5: ='[Competition_Program 2023-2024.xls]Run Program'!$C$9 -> Round 1 | F5: ='[Competition_Program 2023-2024.xls]Run Program'!$C$10 -> Round 2 | H5: ='[Competition_Program 2023-2024.xls]Run Program'!$C$11 -> Round 3 | J5: ='[Competition_Program 2023-2024.xls]Run Program'!$C$12 -> Quarter Final | L5: ='[Competition_Program 2023-2024.xls]Run Program'!$C$13 -> Semi Final | N5: ='[Competition_Program 2023-2024.xls]Run Program'!$C$14 -> Final | P5: ='[Competition_Program 2023-2024.xls]Run Program'!$C$13 -> Semi Final | R5: ='[Competition_Program 2023-2024.xls]Run Program'!$C$12 -> Quarter Final | T5: ='[Competition_Program 2023-2024.xls]Run Program'!$C$11 -> Round 3 | V5: ='[Competition_Program 2023-2024.xls]Run Program'!$C$10 -> Round 2 | X5: ='[Competition_Program 2023-2024.xls]Run Program'!$C$9 -> Round 1 | Z5: =X5&"+" -> Round 1+
D6: Play by | F6: Play by | H6: Play by | J6: Play by | L6: Play by | N6: Play by | P6: Play by | R6: Play by | T6: Play by | V6: Play by | X6: Play by
D7: ='[Competition_Program 2023-2024.xls]Run Program'!$D$9 -> 45228 | F7: ='[Competition_Program 2023-2024.xls]Run Program'!$D$10 -> 45263 | H7: ='[Competition_Program 2023-2024.xls]Run Program'!$D$11 -> 45319 | J7: ='[Competition_Program 2023-2024.xls]Run Program'!$D$12 -> 45354 | L7: ='[Competition_Program 2023-2024.xls]Run Program'!$D$13 -> 45379 | N7: ='[Competition_Program 2023-2024.xls]Run Program'!$D$14 -> 45410 | P7: ='[Competition_Program 2023-2024.xls]Run Program'!$D$13 -> 45379 | R7: ='[Competition_Program 2023-2024.xls]Run Program'!$D$12 -> 45354 | T7: ='[Competition_Program 2023-2024.xls]Run Program'!$D$11 -> 45319 | V7: ='[Competition_Program 2023-2024.xls]Run Program'!$D$10 -> 45263 | X7: ='[Competition_Program 2023-2024.xls]Run Program'!$D$9 -> 45228
B8: ='[Competition_Program 2023-2024.xls]Competition Draw'!$E$2 -> . | D8: ='[Competition_Program 2023-2024.xls]Run Program'!$L$9 -> Best of 3 | F8: ='[Competition_Program 2023-2024.xls]Run Program'!$L$11 -> Best of 3 | H8: ='[Competition_Program 2023-2024.xls]Run Program'!$L$13 -> Best of 3 | J8: ='[Competition_Program 2023-2024.xls]Run Program'!$L$15 -> Best of 3 | L8: ='[Competition_Program 2023-2024.xls]Run Program'!$L$17 -> Best of 5 | N8: ='[Competition_Program 2023-2024.xls]Run Program'!$L$19 -> Best of 5 | P8: ='[Competition_Program 2023-2024.xls]Run Program'!$L$21 -> Best of 5 | R8: ='[Competition_Program 2023-2024.xls]Run Program'!$L$23 -> Best of 3 | T8: ='[Competition_Program 2023-2024.xls]Run Program'!$L$25 -> Best of 3 | V8: ='[Competition_Program 2023-2024.xls]Run Program'!$L$27 -> Best of 3 | X8: ='[Competition_Program 2023-2024.xls]Run Program'!$L$29 -> Best of 3 | Z8: ='[Competition_Program 2023-2024.xls]Competition Draw'!$E$10 -> .
B10: vs | F10: ='[Competition_Program 2023-2024.xls]Competition Draw'!$E$34 -> Hilborne, Steve | V10: ='[Competition_Program 2023-2024.xls]Competition Draw'!$E$42 -> Pilborough, Mark | Z10: vs
B12: ='[Competition_Program 2023-2024.xls]Competition Draw'!$I$2 -> . | D12: ='[Competition_Program 2023-2024.xls]Competition Draw'!$E$18 -> O'Connor, Rory | F12: vs | H12: ='[Competition_Program 2023-2024.xls]Competition Draw'!$E$50 -> . | T12: ='[Competition_Program 2023-2024.xls]Competition Draw'!$E$54 -> . | V12: vs | X12: ='[Competition_Program 2023-2024.xls]Competition Draw'!$E$26 -> . | Z12: ='[Competition_Program 2023-2024.xls]Competition Draw'!$I$10 -> .
D14: vs | F14: ='[Competition_Program 2023-2024.xls]Competition Draw'!$I$34 -> O'Connor, Rory | V14: ='[Competition_Program 2023-2024.xls]Competition Draw'!$I$42 -> Ebbs, John | X14: vs
B16: ='[Competition_Program 2023-2024.xls]Competition Draw'!$E$3 -> . | D16: ='[Competition_Program 2023-2024.xls]Competition Draw'!$I$18 -> Smith, Des | H16: vs | J16: ='[Competition_Program 2023-2024.xls]Competition Draw'!$E$58 -> . | R16: ='[Competition_Program 2023-2024.xls]Competition Draw'!$E$60 -> . | T16: vs | X16: ='[Competition_Program 2023-2024.xls]Competition Draw'!$I$26 -> . | Z16: ='[Competition_Program 2023-2024.xls]Competition Draw'!$E$11 -> .
B18: vs | F18: ='[Competition_Program 2023-2024.xls]Competition Draw'!$E$35 -> O'Connor, Paul | V18: ='[Competition_Program 2023-2024.xls]Competition Draw'!$E$43 -> Hicks, Chris | Z18: vs
B20: ='[Competition_Program 2023-2024.xls]Competition Draw'!$I$3 -> . | D20: ='[Competition_Program 2023-2024.xls]Competition Draw'!$E$19 -> Smith, Sid | F20: vs | H20: ='[Competition_Program 2023-2024.xls]Competition Draw'!$I$50 -> . | T20: ='[Competition_Program 2023-2024.xls]Competition Draw'!$I$54 -> . | V20: vs | X20: ='[Competition_Program 2023-2024.xls]Competition Draw'!$E$27 -> . | Z20: ='[Competition_Program 2023-2024.xls]Competition Draw'!$I$11 -> .
D22: vs | F22: ='[Competition_Program 2023-2024.xls]Competition Draw'!$I$35 -> Smith, Sid | V22: ='[Competition_Program 2023-2024.xls]Competition Draw'!$I$43 -> Doocey, Liam | X22: vs
B24: ='[Competition_Program 2023-2024.xls]Competition Draw'!$E$4 -> . | D24: ='[Competition_Program 2023-2024.xls]Competition Draw'!$I$19 -> Kightley, Oliver | J24: vs | L24: ='[Competition_Program 2023-2024.xls]Competition Draw'!$E$62 -> . | P24: ='[Competition_Program 2023-2024.xls]Competition Draw'!$E$63 -> . | R24: vs | X24: ='[Competition_Program 2023-2024.xls]Competition Draw'!$I$27 -> . | Z24: ='[Competition_Program 2023-2024.xls]Competition Draw'!$E$12 -> .
B26: vs | F26: ='[Competition_Program 2023-2024.xls]Competition Draw'!$E$36 -> Bartropp, Steve | V26: ='[Competition_Program 2023-2024.xls]Competition Draw'!$E$44 -> Cartwright, Bob | Z26: vs
B28: ='[Competition_Program 2023-2024.xls]Competition Draw'!$I$4 -> . | D28: ='[Competition_Program 2023-2024.xls]Competition Draw'!$E$20 -> Chan, Richard | F28: vs | H28: ='[Competition_Program 2023-2024.xls]Competition Draw'!$E$51 -> . | T28: ='[Competition_Program 2023-2024.xls]Competition Draw'!$E$55 -> . | V28: vs | X28: ='[Competition_Program 2023-2024.xls]Competition Draw'!$E$28 -> . | Z28: ='[Competition_Program 2023-2024.xls]Competition Draw'!$I$12 -> .
D30: vs | F30: ='[Competition_Program 2023-2024.xls]Competition Draw'!$I$36 -> Chan, Richard | V30: ='[Competition_Program 2023-2024.xls]Competition Draw'!$I$44 -> Read, Dave | X30: vs
B32: ='[Competition_Program 2023-2024.xls]Competition Draw'!$E$5 -> . | D32: ='[Competition_Program 2023-2024.xls]Competition Draw'!$I$20 -> Andrews, Stephen | H32: vs | J32: ='[Competition_Program 2023-2024.xls]Competition Draw'!$I$58 -> . | R32: ='[Competition_Program 2023-2024.xls]Competition Draw'!$I$60 -> . | T32: vs | X32: ='[Competition_Program 2023-2024.xls]Competition Draw'!$I$28 -> . | Z32: ='[Competition_Program 2023-2024.xls]Competition Draw'!$E$13 -> .
B34: vs | F34: ='[Competition_Program 2023-2024.xls]Competition Draw'!$E$37 -> Lightfoot, Neil | V34: ='[Competition_Program 2023-2024.xls]Competition Draw'!$E$45 -> Elias, Iyad | Z34: vs
B36: ='[Competition_Program 2023-2024.xls]Competition Draw'!$I$5 -> . | D36: ='[Competition_Program 2023-2024.xls]Competition Draw'!$E$21 -> . | F36: vs | H36: ='[Competition_Program 2023-2024.xls]Competition Draw'!$I$51 -> . | N36: ='[Competition_Program 2023-2024.xls]Competition Draw'!$E$64 -> . | T36: ='[Competition_Program 2023-2024.xls]Competition Draw'!$I$55 -> . | V36: vs | X36: ='[Competition_Program 2023-2024.xls]Competition Draw'!$E$29 -> . | Z36: ='[Competition_Program 2023-2024.xls]Competition Draw'!$I$13 -> .
D38: vs | F38: ='[Competition_Program 2023-2024.xls]Competition Draw'!$I$37 -> Somerfield, Benjamin | V38: ='[Competition_Program 2023-2024.xls]Competition Draw'!$I$45 -> Tilson, Jem | X38: vs
N39: Winner
B40: ='[Competition_Program 2023-2024.xls]Competition Draw'!$E$6 -> . | D40: ='[Competition_Program 2023-2024.xls]Competition Draw'!$I$21 -> . | L40: vs | N40: ='[Competition_Program 2023-2024.xls]Competition Draw'!$M$64 -> . | P40: vs | X40: ='[Competition_Program 2023-2024.xls]Competition Draw'!$I$29 -> . | Z40: ='[Competition_Program 2023-2024.xls]Competition Draw'!$E$14 -> .
B42: vs | F42: ='[Competition_Program 2023-2024.xls]Competition Draw'!$E$38 -> Dimaio, Rino | V42: ='[Competition_Program 2023-2024.xls]Competition Draw'!$E$46 -> Deo, Satnam | Z42: vs
B44: ='[Competition_Program 2023-2024.xls]Competition Draw'!$I$6 -> . | D44: ='[Competition_Program 2023-2024.xls]Competition Draw'!$E$22 -> . | F44: vs | H44: ='[Competition_Program 2023-2024.xls]Competition Draw'!$E$52 -> . | N44: ='[Competition_Program 2023-2024.xls]Competition Draw'!$I$64 -> . | T44: ='[Competition_Program 2023-2024.xls]Competition Draw'!$E$56 -> . | V44: vs | X44: ='[Competition_Program 2023-2024.xls]Competition Draw'!$E$30 -> . | Z44: ='[Competition_Program 2023-2024.xls]Competition Draw'!$I$14 -> .
D46: vs | F46: ='[Competition_Program 2023-2024.xls]Competition Draw'!$I$38 -> Motekhasses, Bijan | V46: ='[Competition_Program 2023-2024.xls]Competition Draw'!$I$46 -> Miller, Stephen | X46: vs
B48: ='[Competition_Program 2023-2024.xls]Competition Draw'!$E$7 -> . | D48: ='[Competition_Program 2023-2024.xls]Competition Draw'!$I$22 -> . | H48: vs | J48: ='[Competition_Program 2023-2024.xls]Competition Draw'!$E$59 -> . | R48: ='[Competition_Program 2023-2024.xls]Competition Draw'!$E$61 -> . | X48: ='[Competition_Program 2023-2024.xls]Competition Draw'!$I$30 -> . | Z48: ='[Competition_Program 2023-2024.xls]Competition Draw'!$E$15 -> .
B50: vs | F50: ='[Competition_Program 2023-2024.xls]Competition Draw'!$E$39 -> Currie, Steve | V50: ='[Competition_Program 2023-2024.xls]Competition Draw'!$E$47 -> Gibson, Dylan | Z50: vs
B52: ='[Competition_Program 2023-2024.xls]Competition Draw'!$I$7 -> . | D52: ='[Competition_Program 2023-2024.xls]Competition Draw'!$E$23 -> . | F52: vs | H52: ='[Competition_Program 2023-2024.xls]Competition Draw'!$I$52 -> Andrews, Michael | T52: ='[Competition_Program 2023-2024.xls]Competition Draw'!$I$56 -> . | V52: vs | X52: ='[Competition_Program 2023-2024.xls]Competition Draw'!$E$31 -> . | Z52: ='[Competition_Program 2023-2024.xls]Competition Draw'!$I$15 -> .
D54: vs | F54: ='[Competition_Program 2023-2024.xls]Competition Draw'!$I$39 -> Andrews, Michael | V54: ='[Competition_Program 2023-2024.xls]Competition Draw'!$I$47 -> Tehrani, Ali | X54: vs
B56: ='[Competition_Program 2023-2024.xls]Competition Draw'!$E$8 -> . | D56: ='[Competition_Program 2023-2024.xls]Competition Draw'!$I$23 -> . | L56: ='[Competition_Program 2023-2024.xls]Competition Draw'!$I$62 -> . | P56: ='[Competition_Program 2023-2024.xls]Competition Draw'!$I$63 -> . | R56: vs | X56: ='[Competition_Program 2023-2024.xls]Competition Draw'!$I$31 -> . | Z56: ='[Competition_Program 2023-2024.xls]Competition Draw'!$E$16 -> .
B58: vs | F58: ='[Competition_Program 2023-2024.xls]Competition Draw'!$E$40 -> Gibbs, Steve | V58: ='[Competition_Program 2023-2024.xls]Competition Draw'!$E$48 -> Clarke, Andy | Z58: vs
B60: ='[Competition_Program 2023-2024.xls]Competition Draw'!$I$8 -> . | D60: ='[Competition_Program 2023-2024.xls]Competition Draw'!$E$24 -> . | F60: vs | H60: ='[Competition_Program 2023-2024.xls]Competition Draw'!$E$53 -> . | T60: ='[Competition_Program 2023-2024.xls]Competition Draw'!$E$57 -> . | V60: vs | X60: ='[Competition_Program 2023-2024.xls]Competition Draw'!$E$32 -> Grainger, Martin | Z60: ='[Competition_Program 2023-2024.xls]Competition Draw'!$I$16 -> .
D62: vs | F62: ='[Competition_Program 2023-2024.xls]Competition Draw'!$I$40 -> Chichester, Andrew | V62: ='[Competition_Program 2023-2024.xls]Competition Draw'!$I$48 -> Marchese, Joe | X62: vs
B64: ='[Competition_Program 2023-2024.xls]Competition Draw'!$E$9 -> . | D64: ='[Competition_Program 2023-2024.xls]Competition Draw'!$I$24 -> . | H64: vs | J64: ='[Competition_Program 2023-2024.xls]Competition Draw'!$I$59 -> . | R64: ='[Competition_Program 2023-2024.xls]Competition Draw'!$I$61 -> . | T64: vs | X64: ='[Competition_Program 2023-2024.xls]Competition Draw'!$I$32 -> Marchese, Joe | Z64: ='[Competition_Program 2023-2024.xls]Competition Draw'!$E$17 -> .
B66: vs | F66: ='[Competition_Program 2023-2024.xls]Competition Draw'!$E$41 -> Powell, Rob | V66: ='[Competition_Program 2023-2024.xls]Competition Draw'!$E$49 -> Lampey, Robert | Z66: vs
B68: ='[Competition_Program 2023-2024.xls]Competition Draw'!$I$9 -> . | D68: ='[Competition_Program 2023-2024.xls]Competition Draw'!$E$25 -> . | F68: vs | H68: ='[Competition_Program 2023-2024.xls]Competition Draw'!$I$53 -> . | T68: ='[Competition_Program 2023-2024.xls]Competition Draw'!$I$57 -> . | V68: vs | X68: ='[Competition_Program 2023-2024.xls]Competition Draw'!$E$33 -> Herdman, Andy | Z68: ='[Competition_Program 2023-2024.xls]Competition Draw'!$I$17 -> .
D70: vs | F70: ='[Competition_Program 2023-2024.xls]Competition Draw'!$I$41 -> Sanders, Ian | V70: ='[Competition_Program 2023-2024.xls]Competition Draw'!$I$49 -> Herdman, Andy | X70: vs
D72: ='[Competition_Program 2023-2024.xls]Competition Draw'!$I$25 -> . | X72: ='[Competition_Program 2023-2024.xls]Competition Draw'!$I$33 -> Shaw, Benjamin
A74: Note : Name followed by an accent (^) , denotes that the player claimed the match and was awarded a win at a Committee meeting,
A75: Note: Name followed by an asterisk (*), denotes that the player has been awarded a 'win' by the toss of a coin at a Committee meeting