A2: WGC & District Billiards and Snooker League
A3: Billiards Singles Handicap
B5: =E5&"+" -> Round 1+ | E5: ='[Competition_Program 2023-2024.xls]Run Program'!$C$9 -> Round 1 | H5: ='[Competition_Program 2023-2024.xls]Run Program'!$C$10 -> Round 2 | K5: ='[Competition_Program 2023-2024.xls]Run Program'!$C$11 -> Round 3 | N5: ='[Competition_Program 2023-2024.xls]Run Program'!$C$12 -> Quarter Final | Q5: ='[Competition_Program 2023-2024.xls]Run Program'!$C$13 -> Semi Final | T5: ='[Competition_Program 2023-2024.xls]Run Program'!$C$14 -> Final | W5: ='[Competition_Program 2023-2024.xls]Run Program'!$C$13 -> Semi Final | Z5: ='[Competition_Program 2023-2024.xls]Run Program'!$C$12 -> Quarter Final | AC5: ='[Competition_Program 2023-2024.xls]Run Program'!$C$11 -> Round 3 | AF5: ='[Competition_Program 2023-2024.xls]Run Program'!$C$10 -> Round 2 | AI5: ='[Competition_Program 2023-2024.xls]Run Program'!$C$9 -> Round 1 | AL5: =AI5&"+" -> Round 1+
E6: Play by | H6: Play by | K6: Play by | N6: Play by | Q6: Play by | T6: Play by | W6: Play by | Z6: Play by | AC6: Play by | AF6: Play by | AI6: Play by
E7: ='[Competition_Program 2023-2024.xls]Run Program'!$D$9 -> 45228 | H7: ='[Competition_Program 2023-2024.xls]Run Program'!$D$10 -> 45263 | K7: ='[Competition_Program 2023-2024.xls]Run Program'!$D$11 -> 45319 | N7: ='[Competition_Program 2023-2024.xls]Run Program'!$D$12 -> 45354 | Q7: ='[Competition_Program 2023-2024.xls]Run Program'!$D$13 -> 45379 | T7: ='[Competition_Program 2023-2024.xls]Run Program'!$D$14 -> 45410 | W7: ='[Competition_Program 2023-2024.xls]Run Program'!$D$13 -> 45379 | Z7: ='[Competition_Program 2023-2024.xls]Run Program'!$D$12 -> 45354 | AC7: ='[Competition_Program 2023-2024.xls]Run Program'!$D$11 -> 45319 | AF7: ='[Competition_Program 2023-2024.xls]Run Program'!$D$10 -> 45263 | AI7: ='[Competition_Program 2023-2024.xls]Run Program'!$D$9 -> 45228
B8: ='[Competition_Program 2023-2024.xls]Competition Draw'!$E$317 -> . | C8: ='[Competition_Program 2023-2024.xls]Competition Draw'!$G$317 -> . | E8: ='[Competition_Program 2023-2024.xls]Run Program'!$T$10 -> 200 Up | H8: ='[Competition_Program 2023-2024.xls]Run Program'!$T$13 -> 200 Up | K8: ='[Competition_Program 2023-2024.xls]Run Program'!$T$16 -> 200 Up | N8: ='[Competition_Program 2023-2024.xls]Run Program'!$T$19 -> 200 Up | Q8: ='[Competition_Program 2023-2024.xls]Run Program'!$T$22 -> 200 Up | T8: ='[Competition_Program 2023-2024.xls]Run Program'!$T$25 -> 200 Up | W8: ='[Competition_Program 2023-2024.xls]Run Program'!$T$28 -> 200 Up | Z8: ='[Competition_Program 2023-2024.xls]Run Program'!$T$31 -> 200 Up | AC8: ='[Competition_Program 2023-2024.xls]Run Program'!$T$34 -> 200 Up | AF8: ='[Competition_Program 2023-2024.xls]Run Program'!$T$37 -> 200 Up | AI8: ='[Competition_Program 2023-2024.xls]Run Program'!$T$40 -> 200 Up | AL8: ='[Competition_Program 2023-2024.xls]Competition Draw'!$E$325 -> . | AM8: ='[Competition_Program 2023-2024.xls]Competition Draw'!$G$325 -> .
B10: vs | H10: ='[Competition_Program 2023-2024.xls]Competition Draw'!$E$349 -> Chapman, Bob | I10: ='[Competition_Program 2023-2024.xls]Competition Draw'!$G$349 -> -19 | AF10: ='[Competition_Program 2023-2024.xls]Competition Draw'!$E$357 -> . | AG10: ='[Competition_Program 2023-2024.xls]Competition Draw'!$G$357 -> . | AL10: vs
B12: ='[Competition_Program 2023-2024.xls]Competition Draw'!$I$317 -> . | C12: ='[Competition_Program 2023-2024.xls]Competition Draw'!$K$317 -> . | E12: ='[Competition_Program 2023-2024.xls]Competition Draw'!$E$333 -> . | F12: ='[Competition_Program 2023-2024.xls]Competition Draw'!$G$333 -> . | H12: vs | K12: ='[Competition_Program 2023-2024.xls]Competition Draw'!$E$365 -> . | L12: ='[Competition_Program 2023-2024.xls]Competition Draw'!$G$365 -> . | AC12: ='[Competition_Program 2023-2024.xls]Competition Draw'!$E$369 -> White, Shayne | AD12: ='[Competition_Program 2023-2024.xls]Competition Draw'!$G$369 -> 50 | AF12: vs | AI12: ='[Competition_Program 2023-2024.xls]Competition Draw'!$E$341 -> . | AJ12: ='[Competition_Program 2023-2024.xls]Competition Draw'!$G$341 -> . | AL12: ='[Competition_Program 2023-2024.xls]Competition Draw'!$I$325 -> . | AM12: ='[Competition_Program 2023-2024.xls]Competition Draw'!$K$325 -> .
E14: vs | H14: ='[Competition_Program 2023-2024.xls]Competition Draw'!$I$349 -> Wilde, David | I14: ='[Competition_Program 2023-2024.xls]Competition Draw'!$K$349 -> 44 | AF14: ='[Competition_Program 2023-2024.xls]Competition Draw'!$I$357 -> . | AG14: ='[Competition_Program 2023-2024.xls]Competition Draw'!$K$357 -> . | AI14: vs
B16: ='[Competition_Program 2023-2024.xls]Competition Draw'!$E$318 -> . | C16: ='[Competition_Program 2023-2024.xls]Competition Draw'!$G$318 -> . | E16: ='[Competition_Program 2023-2024.xls]Competition Draw'!$I$333 -> . | F16: ='[Competition_Program 2023-2024.xls]Competition Draw'!$K$333 -> . | K16: vs | N16: ='[Competition_Program 2023-2024.xls]Competition Draw'!$E$373 -> . | O16: ='[Competition_Program 2023-2024.xls]Competition Draw'!$G$373 -> . | Z16: ='[Competition_Program 2023-2024.xls]Competition Draw'!$E$375 -> . | AA16: ='[Competition_Program 2023-2024.xls]Competition Draw'!$G$375 -> . | AC16: vs | AI16: ='[Competition_Program 2023-2024.xls]Competition Draw'!$I$341 -> . | AJ16: ='[Competition_Program 2023-2024.xls]Competition Draw'!$K$341 -> . | AL16: ='[Competition_Program 2023-2024.xls]Competition Draw'!$E$326 -> . | AM16: ='[Competition_Program 2023-2024.xls]Competition Draw'!$G$326 -> .
B18: vs | H18: ='[Competition_Program 2023-2024.xls]Competition Draw'!$E$350 -> O'Connor, Paul | I18: ='[Competition_Program 2023-2024.xls]Competition Draw'!$G$350 -> 29 | AF18: ='[Competition_Program 2023-2024.xls]Competition Draw'!$E$358 -> . | AG18: ='[Competition_Program 2023-2024.xls]Competition Draw'!$G$358 -> . | AL18: vs
B20: ='[Competition_Program 2023-2024.xls]Competition Draw'!$I$318 -> . | C20: ='[Competition_Program 2023-2024.xls]Competition Draw'!$K$318 -> . | E20: ='[Competition_Program 2023-2024.xls]Competition Draw'!$E$334 -> . | F20: ='[Competition_Program 2023-2024.xls]Competition Draw'!$G$334 -> . | H20: vs | K20: ='[Competition_Program 2023-2024.xls]Competition Draw'!$I$365 -> . | L20: ='[Competition_Program 2023-2024.xls]Competition Draw'!$K$365 -> . | AC20: ='[Competition_Program 2023-2024.xls]Competition Draw'!$I$369 -> Warner, Peter | AD20: ='[Competition_Program 2023-2024.xls]Competition Draw'!$K$369 -> -24 | AF20: vs | AI20: ='[Competition_Program 2023-2024.xls]Competition Draw'!$E$342 -> . | AJ20: ='[Competition_Program 2023-2024.xls]Competition Draw'!$G$342 -> . | AL20: ='[Competition_Program 2023-2024.xls]Competition Draw'!$I$326 -> . | AM20: ='[Competition_Program 2023-2024.xls]Competition Draw'!$K$326 -> .
E22: vs | H22: ='[Competition_Program 2023-2024.xls]Competition Draw'!$I$350 -> Miller, Stephen | I22: ='[Competition_Program 2023-2024.xls]Competition Draw'!$K$350 -> -71 | AF22: ='[Competition_Program 2023-2024.xls]Competition Draw'!$I$358 -> . | AG22: ='[Competition_Program 2023-2024.xls]Competition Draw'!$K$358 -> . | AI22: vs
B24: ='[Competition_Program 2023-2024.xls]Competition Draw'!$E$319 -> . | C24: ='[Competition_Program 2023-2024.xls]Competition Draw'!$G$319 -> . | E24: ='[Competition_Program 2023-2024.xls]Competition Draw'!$I$334 -> . | F24: ='[Competition_Program 2023-2024.xls]Competition Draw'!$K$334 -> . | N24: vs | Q24: ='[Competition_Program 2023-2024.xls]Competition Draw'!$E$377 -> . | R24: ='[Competition_Program 2023-2024.xls]Competition Draw'!$G$377 -> . | W24: ='[Competition_Program 2023-2024.xls]Competition Draw'!$E$378 -> . | X24: ='[Competition_Program 2023-2024.xls]Competition Draw'!$G$378 -> . | Z24: vs | AI24: ='[Competition_Program 2023-2024.xls]Competition Draw'!$I$342 -> . | AJ24: ='[Competition_Program 2023-2024.xls]Competition Draw'!$K$342 -> . | AL24: ='[Competition_Program 2023-2024.xls]Competition Draw'!$E$327 -> . | AM24: ='[Competition_Program 2023-2024.xls]Competition Draw'!$G$327 -> .
B26: vs | H26: ='[Competition_Program 2023-2024.xls]Competition Draw'!$E$351 -> Lynch, Sean | I26: ='[Competition_Program 2023-2024.xls]Competition Draw'!$G$351 -> -30 | AF26: ='[Competition_Program 2023-2024.xls]Competition Draw'!$E$359 -> . | AG26: ='[Competition_Program 2023-2024.xls]Competition Draw'!$G$359 -> . | AL26: vs
B28: ='[Competition_Program 2023-2024.xls]Competition Draw'!$I$319 -> . | C28: ='[Competition_Program 2023-2024.xls]Competition Draw'!$K$319 -> . | E28: ='[Competition_Program 2023-2024.xls]Competition Draw'!$E$335 -> . | F28: ='[Competition_Program 2023-2024.xls]Competition Draw'!$G$335 -> . | H28: vs | K28: ='[Competition_Program 2023-2024.xls]Competition Draw'!$E$366 -> . | L28: ='[Competition_Program 2023-2024.xls]Competition Draw'!$G$366 -> . | AC28: ='[Competition_Program 2023-2024.xls]Competition Draw'!$E$370 -> Reade, Liam | AD28: ='[Competition_Program 2023-2024.xls]Competition Draw'!$G$370 -> -65 | AF28: vs | AI28: ='[Competition_Program 2023-2024.xls]Competition Draw'!$E$343 -> . | AJ28: ='[Competition_Program 2023-2024.xls]Competition Draw'!$G$343 -> . | AL28: ='[Competition_Program 2023-2024.xls]Competition Draw'!$I$327 -> . | AM28: ='[Competition_Program 2023-2024.xls]Competition Draw'!$K$327 -> .
E30: vs | H30: ='[Competition_Program 2023-2024.xls]Competition Draw'!$I$351 -> Lampey, Robert | I30: ='[Competition_Program 2023-2024.xls]Competition Draw'!$K$351 -> -20 | AF30: ='[Competition_Program 2023-2024.xls]Competition Draw'!$I$359 -> . | AG30: ='[Competition_Program 2023-2024.xls]Competition Draw'!$K$359 -> . | AI30: vs
B32: ='[Competition_Program 2023-2024.xls]Competition Draw'!$E$320 -> . | C32: ='[Competition_Program 2023-2024.xls]Competition Draw'!$G$320 -> . | E32: ='[Competition_Program 2023-2024.xls]Competition Draw'!$I$335 -> . | F32: ='[Competition_Program 2023-2024.xls]Competition Draw'!$K$335 -> . | K32: vs | N32: ='[Competition_Program 2023-2024.xls]Competition Draw'!$I$373 -> . | O32: ='[Competition_Program 2023-2024.xls]Competition Draw'!$K$373 -> . | Z32: ='[Competition_Program 2023-2024.xls]Competition Draw'!$I$375 -> . | AA32: ='[Competition_Program 2023-2024.xls]Competition Draw'!$K$375 -> . | AC32: vs | AI32: ='[Competition_Program 2023-2024.xls]Competition Draw'!$I$343 -> . | AJ32: ='[Competition_Program 2023-2024.xls]Competition Draw'!$K$343 -> . | AL32: ='[Competition_Program 2023-2024.xls]Competition Draw'!$E$328 -> . | AM32: ='[Competition_Program 2023-2024.xls]Competition Draw'!$G$328 -> .
B34: vs | H34: ='[Competition_Program 2023-2024.xls]Competition Draw'!$E$352 -> Howe, David | I34: ='[Competition_Program 2023-2024.xls]Competition Draw'!$G$352 -> -30 | AF34: ='[Competition_Program 2023-2024.xls]Competition Draw'!$E$360 -> O'Connor, Rory | AG34: ='[Competition_Program 2023-2024.xls]Competition Draw'!$G$360 -> 100 | AL34: vs
B36: ='[Competition_Program 2023-2024.xls]Competition Draw'!$I$320 -> . | C36: ='[Competition_Program 2023-2024.xls]Competition Draw'!$K$320 -> . | E36: ='[Competition_Program 2023-2024.xls]Competition Draw'!$E$336 -> . | F36: ='[Competition_Program 2023-2024.xls]Competition Draw'!$G$336 -> . | H36: vs | K36: ='[Competition_Program 2023-2024.xls]Competition Draw'!$I$366 -> . | L36: ='[Competition_Program 2023-2024.xls]Competition Draw'!$K$366 -> . | T36: ='[Competition_Program 2023-2024.xls]Competition Draw'!$E$379 -> . | U36: ='[Competition_Program 2023-2024.xls]Competition Draw'!$G$379 -> . | AC36: ='[Competition_Program 2023-2024.xls]Competition Draw'!$I$370 -> Thompson, Jim | AD36: ='[Competition_Program 2023-2024.xls]Competition Draw'!$K$370 -> 69 | AF36: vs | AI36: ='[Competition_Program 2023-2024.xls]Competition Draw'!$E$344 -> . | AJ36: ='[Competition_Program 2023-2024.xls]Competition Draw'!$G$344 -> . | AL36: ='[Competition_Program 2023-2024.xls]Competition Draw'!$I$328 -> . | AM36: ='[Competition_Program 2023-2024.xls]Competition Draw'!$K$328 -> .
E38: vs | H38: ='[Competition_Program 2023-2024.xls]Competition Draw'!$I$352 -> Wong, Kit | I38: ='[Competition_Program 2023-2024.xls]Competition Draw'!$K$352 -> -18 | AF38: ='[Competition_Program 2023-2024.xls]Competition Draw'!$I$360 -> Thompson, Jim | AG38: ='[Competition_Program 2023-2024.xls]Competition Draw'!$K$360 -> 69 | AI38: vs
T39: Winner
B40: ='[Competition_Program 2023-2024.xls]Competition Draw'!$E$321 -> . | C40: ='[Competition_Program 2023-2024.xls]Competition Draw'!$G$321 -> . | E40: ='[Competition_Program 2023-2024.xls]Competition Draw'!$I$336 -> . | F40: ='[Competition_Program 2023-2024.xls]Competition Draw'!$K$336 -> . | Q40: vs | T40: ='[Competition_Program 2023-2024.xls]Competition Draw'!$M$379 -> . | AI40: ='[Competition_Program 2023-2024.xls]Competition Draw'!$I$344 -> . | AJ40: ='[Competition_Program 2023-2024.xls]Competition Draw'!$K$344 -> . | AL40: ='[Competition_Program 2023-2024.xls]Competition Draw'!$E$329 -> . | AM40: ='[Competition_Program 2023-2024.xls]Competition Draw'!$G$329 -> .
B42: vs | H42: ='[Competition_Program 2023-2024.xls]Competition Draw'!$E$353 -> Trinder, Tony | I42: ='[Competition_Program 2023-2024.xls]Competition Draw'!$G$353 -> 29 | AF42: ='[Competition_Program 2023-2024.xls]Competition Draw'!$E$361 -> Spinks, John | AG42: ='[Competition_Program 2023-2024.xls]Competition Draw'!$G$361 -> 15 | AL42: vs
B44: ='[Competition_Program 2023-2024.xls]Competition Draw'!$I$321 -> . | C44: ='[Competition_Program 2023-2024.xls]Competition Draw'!$K$321 -> . | E44: ='[Competition_Program 2023-2024.xls]Competition Draw'!$E$337 -> . | F44: ='[Competition_Program 2023-2024.xls]Competition Draw'!$G$337 -> . | H44: vs | K44: ='[Competition_Program 2023-2024.xls]Competition Draw'!$E$367 -> . | L44: ='[Competition_Program 2023-2024.xls]Competition Draw'!$G$367 -> . | T44: ='[Competition_Program 2023-2024.xls]Competition Draw'!$I$379 -> . | U44: ='[Competition_Program 2023-2024.xls]Competition Draw'!$K$379 -> . | AC44: ='[Competition_Program 2023-2024.xls]Competition Draw'!$E$371 -> . | AD44: ='[Competition_Program 2023-2024.xls]Competition Draw'!$G$371 -> . | AF44: vs | AI44: ='[Competition_Program 2023-2024.xls]Competition Draw'!$E$345 -> . | AJ44: ='[Competition_Program 2023-2024.xls]Competition Draw'!$G$345 -> . | AL44: ='[Competition_Program 2023-2024.xls]Competition Draw'!$I$329 -> . | AM44: ='[Competition_Program 2023-2024.xls]Competition Draw'!$K$329 -> .
E46: vs | H46: ='[Competition_Program 2023-2024.xls]Competition Draw'!$I$353 -> Caulfield, Sean | I46: ='[Competition_Program 2023-2024.xls]Competition Draw'!$K$353 -> 1 | AF46: ='[Competition_Program 2023-2024.xls]Competition Draw'!$I$361 -> Batehup, Keith | AG46: ='[Competition_Program 2023-2024.xls]Competition Draw'!$K$361 -> -4 | AI46: vs
B48: ='[Competition_Program 2023-2024.xls]Competition Draw'!$E$322 -> . | C48: ='[Competition_Program 2023-2024.xls]Competition Draw'!$G$322 -> . | E48: ='[Competition_Program 2023-2024.xls]Competition Draw'!$I$337 -> . | F48: ='[Competition_Program 2023-2024.xls]Competition Draw'!$K$337 -> . | K48: vs | N48: ='[Competition_Program 2023-2024.xls]Competition Draw'!$E$374 -> . | O48: ='[Competition_Program 2023-2024.xls]Competition Draw'!$G$374 -> . | Z48: ='[Competition_Program 2023-2024.xls]Competition Draw'!$E$376 -> . | AA48: ='[Competition_Program 2023-2024.xls]Competition Draw'!$G$376 -> . | AC48: vs | AI48: ='[Competition_Program 2023-2024.xls]Competition Draw'!$I$345 -> . | AJ48: ='[Competition_Program 2023-2024.xls]Competition Draw'!$K$345 -> . | AL48: ='[Competition_Program 2023-2024.xls]Competition Draw'!$E$330 -> . | AM48: ='[Competition_Program 2023-2024.xls]Competition Draw'!$G$330 -> .
B50: vs | H50: ='[Competition_Program 2023-2024.xls]Competition Draw'!$E$354 -> Andrews, Michael | I50: ='[Competition_Program 2023-2024.xls]Competition Draw'!$G$354 -> -30 | AF50: ='[Competition_Program 2023-2024.xls]Competition Draw'!$E$362 -> Bonner, Kevin | AG50: ='[Competition_Program 2023-2024.xls]Competition Draw'!$G$362 -> 44 | AL50: vs
B52: ='[Competition_Program 2023-2024.xls]Competition Draw'!$I$322 -> . | C52: ='[Competition_Program 2023-2024.xls]Competition Draw'!$K$322 -> . | E52: ='[Competition_Program 2023-2024.xls]Competition Draw'!$E$338 -> . | F52: ='[Competition_Program 2023-2024.xls]Competition Draw'!$G$338 -> . | H52: vs | K52: ='[Competition_Program 2023-2024.xls]Competition Draw'!$I$367 -> . | L52: ='[Competition_Program 2023-2024.xls]Competition Draw'!$K$367 -> . | AC52: ='[Competition_Program 2023-2024.xls]Competition Draw'!$I$371 -> . | AD52: ='[Competition_Program 2023-2024.xls]Competition Draw'!$K$371 -> . | AF52: vs | AI52: ='[Competition_Program 2023-2024.xls]Competition Draw'!$E$346 -> . | AJ52: ='[Competition_Program 2023-2024.xls]Competition Draw'!$G$346 -> . | AL52: ='[Competition_Program 2023-2024.xls]Competition Draw'!$I$330 -> . | AM52: ='[Competition_Program 2023-2024.xls]Competition Draw'!$K$330 -> .
E54: vs | H54: ='[Competition_Program 2023-2024.xls]Competition Draw'!$I$354 -> Smith, Steve | I54: ='[Competition_Program 2023-2024.xls]Competition Draw'!$K$354 -> -74 | AF54: ='[Competition_Program 2023-2024.xls]Competition Draw'!$I$362 -> Marchese, Joe | AG54: ='[Competition_Program 2023-2024.xls]Competition Draw'!$K$362 -> 36 | AI54: vs
B56: ='[Competition_Program 2023-2024.xls]Competition Draw'!$E$323 -> . | C56: ='[Competition_Program 2023-2024.xls]Competition Draw'!$G$323 -> . | E56: ='[Competition_Program 2023-2024.xls]Competition Draw'!$I$338 -> . | F56: ='[Competition_Program 2023-2024.xls]Competition Draw'!$K$338 -> . | N56: vs | Q56: ='[Competition_Program 2023-2024.xls]Competition Draw'!$I$377 -> . | R56: ='[Competition_Program 2023-2024.xls]Competition Draw'!$K$377 -> . | W56: ='[Competition_Program 2023-2024.xls]Competition Draw'!$I$378 -> . | X56: ='[Competition_Program 2023-2024.xls]Competition Draw'!$K$378 -> . | Z56: vs | AI56: ='[Competition_Program 2023-2024.xls]Competition Draw'!$I$346 -> . | AJ56: ='[Competition_Program 2023-2024.xls]Competition Draw'!$K$346 -> . | AL56: ='[Competition_Program 2023-2024.xls]Competition Draw'!$E$331 -> . | AM56: ='[Competition_Program 2023-2024.xls]Competition Draw'!$G$331 -> .
B58: vs | H58: ='[Competition_Program 2023-2024.xls]Competition Draw'!$E$355 -> . | I58: ='[Competition_Program 2023-2024.xls]Competition Draw'!$G$355 -> . | AF58: ='[Competition_Program 2023-2024.xls]Competition Draw'!$E$363 -> Gibbs, Steve | AG58: ='[Competition_Program 2023-2024.xls]Competition Draw'!$G$363 -> -30 | AL58: vs
B60: ='[Competition_Program 2023-2024.xls]Competition Draw'!$I$323 -> . | C60: ='[Competition_Program 2023-2024.xls]Competition Draw'!$K$323 -> . | E60: ='[Competition_Program 2023-2024.xls]Competition Draw'!$E$339 -> . | F60: ='[Competition_Program 2023-2024.xls]Competition Draw'!$G$339 -> . | H60: vs | K60: ='[Competition_Program 2023-2024.xls]Competition Draw'!$E$368 -> Hale, Lee | L60: ='[Competition_Program 2023-2024.xls]Competition Draw'!$G$368 -> 100 | AC60: ='[Competition_Program 2023-2024.xls]Competition Draw'!$E$372 -> . | AD60: ='[Competition_Program 2023-2024.xls]Competition Draw'!$G$372 -> . | AF60: vs | AI60: ='[Competition_Program 2023-2024.xls]Competition Draw'!$E$347 -> . | AJ60: ='[Competition_Program 2023-2024.xls]Competition Draw'!$G$347 -> . | AL60: ='[Competition_Program 2023-2024.xls]Competition Draw'!$I$331 -> . | AM60: ='[Competition_Program 2023-2024.xls]Competition Draw'!$K$331 -> .
E62: vs | H62: ='[Competition_Program 2023-2024.xls]Competition Draw'!$I$355 -> . | I62: ='[Competition_Program 2023-2024.xls]Competition Draw'!$K$355 -> . | AF62: ='[Competition_Program 2023-2024.xls]Competition Draw'!$I$363 -> Elias, Iyad | AG62: ='[Competition_Program 2023-2024.xls]Competition Draw'!$K$363 -> -30 | AI62: vs
B64: ='[Competition_Program 2023-2024.xls]Competition Draw'!$E$324 -> . | C64: ='[Competition_Program 2023-2024.xls]Competition Draw'!$G$324 -> . | E64: ='[Competition_Program 2023-2024.xls]Competition Draw'!$I$339 -> . | F64: ='[Competition_Program 2023-2024.xls]Competition Draw'!$K$339 -> . | K64: vs | N64: ='[Competition_Program 2023-2024.xls]Competition Draw'!$I$374 -> . | O64: ='[Competition_Program 2023-2024.xls]Competition Draw'!$K$374 -> . | Z64: ='[Competition_Program 2023-2024.xls]Competition Draw'!$I$376 -> . | AA64: ='[Competition_Program 2023-2024.xls]Competition Draw'!$K$376 -> . | AC64: vs | AI64: ='[Competition_Program 2023-2024.xls]Competition Draw'!$I$347 -> . | AJ64: ='[Competition_Program 2023-2024.xls]Competition Draw'!$K$347 -> . | AL64: ='[Competition_Program 2023-2024.xls]Competition Draw'!$E$332 -> . | AM64: ='[Competition_Program 2023-2024.xls]Competition Draw'!$G$332 -> .
B66: vs | H66: ='[Competition_Program 2023-2024.xls]Competition Draw'!$E$356 -> . | I66: ='[Competition_Program 2023-2024.xls]Competition Draw'!$G$356 -> . | AF66: ='[Competition_Program 2023-2024.xls]Competition Draw'!$E$364 -> Poulter, Adrian | AG66: ='[Competition_Program 2023-2024.xls]Competition Draw'!$G$364 -> -56 | AL66: vs
B68: ='[Competition_Program 2023-2024.xls]Competition Draw'!$I$324 -> . | C68: ='[Competition_Program 2023-2024.xls]Competition Draw'!$K$324 -> . | E68: ='[Competition_Program 2023-2024.xls]Competition Draw'!$E$340 -> . | F68: ='[Competition_Program 2023-2024.xls]Competition Draw'!$G$340 -> . | H68: vs | K68: ='[Competition_Program 2023-2024.xls]Competition Draw'!$I$368 -> Cartwright, Bob | L68: ='[Competition_Program 2023-2024.xls]Competition Draw'!$K$368 -> 65 | AC68: ='[Competition_Program 2023-2024.xls]Competition Draw'!$I$372 -> . | AD68: ='[Competition_Program 2023-2024.xls]Competition Draw'!$K$372 -> . | AF68: vs | AI68: ='[Competition_Program 2023-2024.xls]Competition Draw'!$E$348 -> . | AJ68: ='[Competition_Program 2023-2024.xls]Competition Draw'!$G$348 -> . | AL68: ='[Competition_Program 2023-2024.xls]Competition Draw'!$I$332 -> . | AM68: ='[Competition_Program 2023-2024.xls]Competition Draw'!$K$332 -> .
E70: vs | H70: ='[Competition_Program 2023-2024.xls]Competition Draw'!$I$356 -> . | I70: ='[Competition_Program 2023-2024.xls]Competition Draw'!$K$356 -> . | AF70: ='[Competition_Program 2023-2024.xls]Competition Draw'!$I$364 -> McCague, Hugh | AG70: ='[Competition_Program 2023-2024.xls]Competition Draw'!$K$364 -> 30 | AI70: vs
E72: ='[Competition_Program 2023-2024.xls]Competition Draw'!$I$340 -> . | F72: ='[Competition_Program 2023-2024.xls]Competition Draw'!$K$340 -> . | AI72: ='[Competition_Program 2023-2024.xls]Competition Draw'!$I$348 -> . | AJ72: ='[Competition_Program 2023-2024.xls]Competition Draw'!$K$348 -> .
A74: Note : Name followed by an accent (^) , denotes that the player claimed the match and was awarded a win at a Committee meeting,
A75: Note: Name followed by an asterisk (*), denotes that the player has been awarded a 'win' by the toss of a coin at a Committee meeting