A2: WGC & District Billiards and Snooker League
A3: Snooker Singles Handicap
B5: =E5&"+" -> Round 1+ | E5: ='[Competition_Program 2023-2024.xls]Run Program'!$C$9 -> Round 1 | H5: ='[Competition_Program 2023-2024.xls]Run Program'!$C$10 -> Round 2 | K5: ='[Competition_Program 2023-2024.xls]Run Program'!$C$11 -> Round 3 | N5: ='[Competition_Program 2023-2024.xls]Run Program'!$C$12 -> Quarter Final | Q5: ='[Competition_Program 2023-2024.xls]Run Program'!$C$13 -> Semi Final | T5: ='[Competition_Program 2023-2024.xls]Run Program'!$C$14 -> Final | W5: ='[Competition_Program 2023-2024.xls]Run Program'!$C$13 -> Semi Final | Z5: ='[Competition_Program 2023-2024.xls]Run Program'!$C$12 -> Quarter Final | AC5: ='[Competition_Program 2023-2024.xls]Run Program'!$C$11 -> Round 3 | AF5: ='[Competition_Program 2023-2024.xls]Run Program'!$C$10 -> Round 2 | AI5: ='[Competition_Program 2023-2024.xls]Run Program'!$C$9 -> Round 1 | AL5: =AI5&"+" -> Round 1+
E6: Play by | H6: Play by | K6: Play by | N6: Play by | Q6: Play by | T6: Play by | W6: Play by | Z6: Play by | AC6: Play by | AF6: Play by | AI6: Play by
E7: ='[Competition_Program 2023-2024.xls]Run Program'!$D$9 -> 45228 | H7: ='[Competition_Program 2023-2024.xls]Run Program'!$D$10 -> 45263 | K7: ='[Competition_Program 2023-2024.xls]Run Program'!$D$11 -> 45319 | N7: ='[Competition_Program 2023-2024.xls]Run Program'!$D$12 -> 45354 | Q7: ='[Competition_Program 2023-2024.xls]Run Program'!$D$13 -> 45379 | T7: ='[Competition_Program 2023-2024.xls]Run Program'!$D$14 -> 45410 | W7: ='[Competition_Program 2023-2024.xls]Run Program'!$D$13 -> 45379 | Z7: ='[Competition_Program 2023-2024.xls]Run Program'!$D$12 -> 45354 | AC7: ='[Competition_Program 2023-2024.xls]Run Program'!$D$11 -> 45319 | AF7: ='[Competition_Program 2023-2024.xls]Run Program'!$D$10 -> 45263 | AI7: ='[Competition_Program 2023-2024.xls]Run Program'!$D$9 -> 45228
B8: ='[Competition_Program 2023-2024.xls]Competition Draw'!$E$65 -> Shaw, Benjamin | C8: ='[Competition_Program 2023-2024.xls]Competition Draw'!$G$65 -> 27 | E8: ='[Competition_Program 2023-2024.xls]Run Program'!$R$10 -> Best of 3 | H8: ='[Competition_Program 2023-2024.xls]Run Program'!$R$13 -> Best of 3 | K8: ='[Competition_Program 2023-2024.xls]Run Program'!$R$16 -> Best of 3 | N8: ='[Competition_Program 2023-2024.xls]Run Program'!$R$19 -> Best of 3 | Q8: ='[Competition_Program 2023-2024.xls]Run Program'!$R$22 -> Best of 3 | T8: ='[Competition_Program 2023-2024.xls]Run Program'!$R$25 -> Best of 5 | W8: ='[Competition_Program 2023-2024.xls]Run Program'!$R$28 -> Best of 3 | Z8: ='[Competition_Program 2023-2024.xls]Run Program'!$R$31 -> Best of 3 | AC8: ='[Competition_Program 2023-2024.xls]Run Program'!$R$34 -> Best of 3 | AF8: ='[Competition_Program 2023-2024.xls]Run Program'!$R$37 -> Best of 3 | AI8: ='[Competition_Program 2023-2024.xls]Run Program'!$R$40 -> Best of 3 | AL8: ='[Competition_Program 2023-2024.xls]Competition Draw'!$E$73 -> Marchese, Joe | AM8: ='[Competition_Program 2023-2024.xls]Competition Draw'!$G$73 -> 20
B10: vs | H10: ='[Competition_Program 2023-2024.xls]Competition Draw'!$E$97 -> . | I10: ='[Competition_Program 2023-2024.xls]Competition Draw'!$G$97 -> . | AF10: ='[Competition_Program 2023-2024.xls]Competition Draw'!$E$105 -> Marchese, Joe | AG10: ='[Competition_Program 2023-2024.xls]Competition Draw'!$G$105 -> 20 | AL10: vs
B12: ='[Competition_Program 2023-2024.xls]Competition Draw'!$I$65 -> Goldsmith, Darren | C12: ='[Competition_Program 2023-2024.xls]Competition Draw'!$K$65 -> 10 | E12: ='[Competition_Program 2023-2024.xls]Competition Draw'!$E$81 -> Tehrani, Ali | F12: ='[Competition_Program 2023-2024.xls]Competition Draw'!$G$81 -> 15 | H12: vs | K12: ='[Competition_Program 2023-2024.xls]Competition Draw'!$E$113 -> . | L12: ='[Competition_Program 2023-2024.xls]Competition Draw'!$G$113 -> . | AC12: ='[Competition_Program 2023-2024.xls]Competition Draw'!$E$117 -> . | AD12: ='[Competition_Program 2023-2024.xls]Competition Draw'!$G$117 -> . | AF12: vs | AI12: ='[Competition_Program 2023-2024.xls]Competition Draw'!$E$89 -> Doocey, Liam | AJ12: ='[Competition_Program 2023-2024.xls]Competition Draw'!$G$89 -> 1 | AL12: ='[Competition_Program 2023-2024.xls]Competition Draw'!$I$73 -> Merryfield, Phillip | AM12: ='[Competition_Program 2023-2024.xls]Competition Draw'!$K$73 -> 9
E14: vs | H14: ='[Competition_Program 2023-2024.xls]Competition Draw'!$I$97 -> Hodgson, Nick | I14: ='[Competition_Program 2023-2024.xls]Competition Draw'!$K$97 -> 16 | AF14: ='[Competition_Program 2023-2024.xls]Competition Draw'!$I$105 -> Doocey, Liam | AG14: ='[Competition_Program 2023-2024.xls]Competition Draw'!$K$105 -> 1 | AI14: vs
B16: ='[Competition_Program 2023-2024.xls]Competition Draw'!$E$66 -> Cooper, Denis | C16: ='[Competition_Program 2023-2024.xls]Competition Draw'!$G$66 -> 52 | E16: ='[Competition_Program 2023-2024.xls]Competition Draw'!$I$81 -> Hodgson, Nick | F16: ='[Competition_Program 2023-2024.xls]Competition Draw'!$K$81 -> 16 | K16: vs | N16: ='[Competition_Program 2023-2024.xls]Competition Draw'!$E$121 -> . | O16: ='[Competition_Program 2023-2024.xls]Competition Draw'!$G$121 -> . | Z16: ='[Competition_Program 2023-2024.xls]Competition Draw'!$E$123 -> . | AA16: ='[Competition_Program 2023-2024.xls]Competition Draw'!$G$123 -> . | AC16: vs | AI16: ='[Competition_Program 2023-2024.xls]Competition Draw'!$I$89 -> Chapman, Bob | AJ16: ='[Competition_Program 2023-2024.xls]Competition Draw'!$K$89 -> 5 | AL16: ='[Competition_Program 2023-2024.xls]Competition Draw'!$E$74 -> . | AM16: ='[Competition_Program 2023-2024.xls]Competition Draw'!$G$74 -> .
B18: vs | H18: ='[Competition_Program 2023-2024.xls]Competition Draw'!$E$98 -> . | I18: ='[Competition_Program 2023-2024.xls]Competition Draw'!$G$98 -> . | AF18: ='[Competition_Program 2023-2024.xls]Competition Draw'!$E$106 -> Powell, Rob | AG18: ='[Competition_Program 2023-2024.xls]Competition Draw'!$G$106 -> -51 | AL18: vs
B20: ='[Competition_Program 2023-2024.xls]Competition Draw'!$I$66 -> Lund, Simon | C20: ='[Competition_Program 2023-2024.xls]Competition Draw'!$K$66 -> 18 | E20: ='[Competition_Program 2023-2024.xls]Competition Draw'!$E$82 -> Hilborne, Steve | F20: ='[Competition_Program 2023-2024.xls]Competition Draw'!$G$82 -> 7 | H20: vs | K20: ='[Competition_Program 2023-2024.xls]Competition Draw'!$I$113 -> . | L20: ='[Competition_Program 2023-2024.xls]Competition Draw'!$K$113 -> . | AC20: ='[Competition_Program 2023-2024.xls]Competition Draw'!$I$117 -> . | AD20: ='[Competition_Program 2023-2024.xls]Competition Draw'!$K$117 -> . | AF20: vs | AI20: ='[Competition_Program 2023-2024.xls]Competition Draw'!$E$90 -> Pond, Callum | AJ20: ='[Competition_Program 2023-2024.xls]Competition Draw'!$G$90 -> -3 | AL20: ='[Competition_Program 2023-2024.xls]Competition Draw'!$I$74 -> . | AM20: ='[Competition_Program 2023-2024.xls]Competition Draw'!$K$74 -> .
E22: vs | H22: ='[Competition_Program 2023-2024.xls]Competition Draw'!$I$98 -> Hilborne, Steve^ | I22: ='[Competition_Program 2023-2024.xls]Competition Draw'!$K$98 -> 7 | AF22: ='[Competition_Program 2023-2024.xls]Competition Draw'!$I$106 -> Pond, Callum | AG22: ='[Competition_Program 2023-2024.xls]Competition Draw'!$K$106 -> -3 | AI22: vs
B24: ='[Competition_Program 2023-2024.xls]Competition Draw'!$E$67 -> Colborne, David | C24: ='[Competition_Program 2023-2024.xls]Competition Draw'!$G$67 -> 41 | E24: ='[Competition_Program 2023-2024.xls]Competition Draw'!$I$82 -> Brunson, Rob | F24: ='[Competition_Program 2023-2024.xls]Competition Draw'!$K$82 -> 50 | N24: vs | Q24: ='[Competition_Program 2023-2024.xls]Competition Draw'!$E$125 -> . | R24: ='[Competition_Program 2023-2024.xls]Competition Draw'!$G$125 -> . | W24: ='[Competition_Program 2023-2024.xls]Competition Draw'!$E$126 -> . | X24: ='[Competition_Program 2023-2024.xls]Competition Draw'!$G$126 -> . | Z24: vs | AI24: ='[Competition_Program 2023-2024.xls]Competition Draw'!$I$90 -> Thompson, Jim | AJ24: ='[Competition_Program 2023-2024.xls]Competition Draw'!$K$90 -> 38 | AL24: ='[Competition_Program 2023-2024.xls]Competition Draw'!$E$75 -> Brunel, Nick | AM24: ='[Competition_Program 2023-2024.xls]Competition Draw'!$G$75 -> 33
B26: vs | H26: ='[Competition_Program 2023-2024.xls]Competition Draw'!$E$99 -> Colborne, David | I26: ='[Competition_Program 2023-2024.xls]Competition Draw'!$G$99 -> 41 | AF26: ='[Competition_Program 2023-2024.xls]Competition Draw'!$E$107 -> . | AG26: ='[Competition_Program 2023-2024.xls]Competition Draw'!$G$107 -> . | AL26: vs
B28: ='[Competition_Program 2023-2024.xls]Competition Draw'!$I$67 -> Dimaio, Rino | C28: ='[Competition_Program 2023-2024.xls]Competition Draw'!$K$67 -> 21 | E28: ='[Competition_Program 2023-2024.xls]Competition Draw'!$E$83 -> Warner, Peter | F28: ='[Competition_Program 2023-2024.xls]Competition Draw'!$G$83 -> 7 | H28: vs | K28: ='[Competition_Program 2023-2024.xls]Competition Draw'!$E$114 -> . | L28: ='[Competition_Program 2023-2024.xls]Competition Draw'!$G$114 -> . | AC28: ='[Competition_Program 2023-2024.xls]Competition Draw'!$E$118 -> . | AD28: ='[Competition_Program 2023-2024.xls]Competition Draw'!$G$118 -> . | AF28: vs | AI28: ='[Competition_Program 2023-2024.xls]Competition Draw'!$E$91 -> McCague, Hugh | AJ28: ='[Competition_Program 2023-2024.xls]Competition Draw'!$G$91 -> 22 | AL28: ='[Competition_Program 2023-2024.xls]Competition Draw'!$I$75 -> Alexander, Adam | AM28: ='[Competition_Program 2023-2024.xls]Competition Draw'!$K$75 -> 21
E30: vs | H30: ='[Competition_Program 2023-2024.xls]Competition Draw'!$I$99 -> Warner, Peter | I30: ='[Competition_Program 2023-2024.xls]Competition Draw'!$K$99 -> 7 | AF30: ='[Competition_Program 2023-2024.xls]Competition Draw'!$I$107 -> . | AG30: ='[Competition_Program 2023-2024.xls]Competition Draw'!$K$107 -> . | AI30: vs
B32: ='[Competition_Program 2023-2024.xls]Competition Draw'!$E$68 -> Gibbs, Steve | C32: ='[Competition_Program 2023-2024.xls]Competition Draw'!$G$68 -> -31 | E32: ='[Competition_Program 2023-2024.xls]Competition Draw'!$I$83 -> O'Connor, Paul | F32: ='[Competition_Program 2023-2024.xls]Competition Draw'!$K$83 -> -6 | K32: vs | N32: ='[Competition_Program 2023-2024.xls]Competition Draw'!$I$121 -> . | O32: ='[Competition_Program 2023-2024.xls]Competition Draw'!$K$121 -> . | Z32: ='[Competition_Program 2023-2024.xls]Competition Draw'!$I$123 -> . | AA32: ='[Competition_Program 2023-2024.xls]Competition Draw'!$K$123 -> . | AC32: vs | AI32: ='[Competition_Program 2023-2024.xls]Competition Draw'!$I$91 -> Elias, Iyad | AJ32: ='[Competition_Program 2023-2024.xls]Competition Draw'!$K$91 -> -23 | AL32: ='[Competition_Program 2023-2024.xls]Competition Draw'!$E$76 -> Herdman, Andy | AM32: ='[Competition_Program 2023-2024.xls]Competition Draw'!$G$76 -> -10
B34: vs | H34: ='[Competition_Program 2023-2024.xls]Competition Draw'!$E$100 -> Gibbs, Steve | I34: ='[Competition_Program 2023-2024.xls]Competition Draw'!$G$100 -> -31 | AF34: ='[Competition_Program 2023-2024.xls]Competition Draw'!$E$108 -> Herdman, Andy | AG34: ='[Competition_Program 2023-2024.xls]Competition Draw'!$G$108 -> -10 | AL34: vs
B36: ='[Competition_Program 2023-2024.xls]Competition Draw'!$I$68 -> Andrews, Stephen | C36: ='[Competition_Program 2023-2024.xls]Competition Draw'!$K$68 -> 1 | E36: ='[Competition_Program 2023-2024.xls]Competition Draw'!$E$84 -> Grainger, Martin | F36: ='[Competition_Program 2023-2024.xls]Competition Draw'!$G$84 -> -7 | H36: vs | K36: ='[Competition_Program 2023-2024.xls]Competition Draw'!$I$114 -> . | L36: ='[Competition_Program 2023-2024.xls]Competition Draw'!$K$114 -> . | T36: ='[Competition_Program 2023-2024.xls]Competition Draw'!$E$127 -> . | U36: ='[Competition_Program 2023-2024.xls]Competition Draw'!$G$127 -> . | AC36: ='[Competition_Program 2023-2024.xls]Competition Draw'!$I$118 -> . | AD36: ='[Competition_Program 2023-2024.xls]Competition Draw'!$K$118 -> . | AF36: vs | AI36: ='[Competition_Program 2023-2024.xls]Competition Draw'!$E$92 -> Ebbs, John | AJ36: ='[Competition_Program 2023-2024.xls]Competition Draw'!$G$92 -> -5 | AL36: ='[Competition_Program 2023-2024.xls]Competition Draw'!$I$76 -> Harding, Ricky | AM36: ='[Competition_Program 2023-2024.xls]Competition Draw'!$K$76 -> 13
E38: vs | H38: ='[Competition_Program 2023-2024.xls]Competition Draw'!$I$100 -> . | I38: ='[Competition_Program 2023-2024.xls]Competition Draw'!$K$100 -> . | AF38: ='[Competition_Program 2023-2024.xls]Competition Draw'!$I$108 -> . | AG38: ='[Competition_Program 2023-2024.xls]Competition Draw'!$K$108 -> . | AI38: vs
T39: Winner
B40: ='[Competition_Program 2023-2024.xls]Competition Draw'!$E$69 -> Patel, Hemant | C40: ='[Competition_Program 2023-2024.xls]Competition Draw'!$G$69 -> 30 | E40: ='[Competition_Program 2023-2024.xls]Competition Draw'!$I$84 -> Potts, John | F40: ='[Competition_Program 2023-2024.xls]Competition Draw'!$K$84 -> 6 | Q40: vs | T40: ='[Competition_Program 2023-2024.xls]Competition Draw'!$M$127 -> . | AI40: ='[Competition_Program 2023-2024.xls]Competition Draw'!$I$92 -> Clarke, Andy | AJ40: ='[Competition_Program 2023-2024.xls]Competition Draw'!$K$92 -> 11 | AL40: ='[Competition_Program 2023-2024.xls]Competition Draw'!$E$77 -> . | AM40: ='[Competition_Program 2023-2024.xls]Competition Draw'!$G$77 -> .
B42: vs | H42: ='[Competition_Program 2023-2024.xls]Competition Draw'!$E$101 -> Patel, Hemant | I42: ='[Competition_Program 2023-2024.xls]Competition Draw'!$G$101 -> 30 | AF42: ='[Competition_Program 2023-2024.xls]Competition Draw'!$E$109 -> Hampton, Stephen | AG42: ='[Competition_Program 2023-2024.xls]Competition Draw'!$G$109 -> 7 | AL42: vs
B44: ='[Competition_Program 2023-2024.xls]Competition Draw'!$I$69 -> Cartwright, Bob | C44: ='[Competition_Program 2023-2024.xls]Competition Draw'!$K$69 -> 27 | E44: ='[Competition_Program 2023-2024.xls]Competition Draw'!$E$85 -> Kightley, Oliver | F44: ='[Competition_Program 2023-2024.xls]Competition Draw'!$G$85 -> -33 | H44: vs | K44: ='[Competition_Program 2023-2024.xls]Competition Draw'!$E$115 -> . | L44: ='[Competition_Program 2023-2024.xls]Competition Draw'!$G$115 -> . | T44: ='[Competition_Program 2023-2024.xls]Competition Draw'!$I$127 -> . | U44: ='[Competition_Program 2023-2024.xls]Competition Draw'!$K$127 -> . | AC44: ='[Competition_Program 2023-2024.xls]Competition Draw'!$E$119 -> . | AD44: ='[Competition_Program 2023-2024.xls]Competition Draw'!$G$119 -> . | AF44: vs | AI44: ='[Competition_Program 2023-2024.xls]Competition Draw'!$E$93 -> Bailey, Rob | AJ44: ='[Competition_Program 2023-2024.xls]Competition Draw'!$G$93 -> 45 | AL44: ='[Competition_Program 2023-2024.xls]Competition Draw'!$I$77 -> . | AM44: ='[Competition_Program 2023-2024.xls]Competition Draw'!$K$77 -> .
E46: vs | H46: ='[Competition_Program 2023-2024.xls]Competition Draw'!$I$101 -> . | I46: ='[Competition_Program 2023-2024.xls]Competition Draw'!$K$101 -> . | AF46: ='[Competition_Program 2023-2024.xls]Competition Draw'!$I$109 -> . | AG46: ='[Competition_Program 2023-2024.xls]Competition Draw'!$K$109 -> . | AI46: vs
B48: ='[Competition_Program 2023-2024.xls]Competition Draw'!$E$70 -> Read, Dave | C48: ='[Competition_Program 2023-2024.xls]Competition Draw'!$G$70 -> -27 | E48: ='[Competition_Program 2023-2024.xls]Competition Draw'!$I$85 -> Carter, Eric | F48: ='[Competition_Program 2023-2024.xls]Competition Draw'!$K$85 -> 50 | K48: vs | N48: ='[Competition_Program 2023-2024.xls]Competition Draw'!$E$122 -> . | O48: ='[Competition_Program 2023-2024.xls]Competition Draw'!$G$122 -> . | Z48: ='[Competition_Program 2023-2024.xls]Competition Draw'!$E$124 -> . | AA48: ='[Competition_Program 2023-2024.xls]Competition Draw'!$G$124 -> . | AC48: vs | AI48: ='[Competition_Program 2023-2024.xls]Competition Draw'!$I$93 -> Pilborough, Mark | AJ48: ='[Competition_Program 2023-2024.xls]Competition Draw'!$K$93 -> -38 | AL48: ='[Competition_Program 2023-2024.xls]Competition Draw'!$E$78 -> Bunney, David | AM48: ='[Competition_Program 2023-2024.xls]Competition Draw'!$G$78 -> -2
B50: vs | H50: ='[Competition_Program 2023-2024.xls]Competition Draw'!$E$102 -> Miller, Stephen | I50: ='[Competition_Program 2023-2024.xls]Competition Draw'!$G$102 -> -8 | AF50: ='[Competition_Program 2023-2024.xls]Competition Draw'!$E$110 -> . | AG50: ='[Competition_Program 2023-2024.xls]Competition Draw'!$G$110 -> . | AL50: vs
B52: ='[Competition_Program 2023-2024.xls]Competition Draw'!$I$70 -> Miller, Stephen | C52: ='[Competition_Program 2023-2024.xls]Competition Draw'!$K$70 -> -8 | E52: ='[Competition_Program 2023-2024.xls]Competition Draw'!$E$86 -> Chapman, Sean | F52: ='[Competition_Program 2023-2024.xls]Competition Draw'!$G$86 -> 23 | H52: vs | K52: ='[Competition_Program 2023-2024.xls]Competition Draw'!$I$115 -> . | L52: ='[Competition_Program 2023-2024.xls]Competition Draw'!$K$115 -> . | AC52: ='[Competition_Program 2023-2024.xls]Competition Draw'!$I$119 -> . | AD52: ='[Competition_Program 2023-2024.xls]Competition Draw'!$K$119 -> . | AF52: vs | AI52: ='[Competition_Program 2023-2024.xls]Competition Draw'!$E$94 -> Sanders, Ian | AJ52: ='[Competition_Program 2023-2024.xls]Competition Draw'!$G$94 -> 19 | AL52: ='[Competition_Program 2023-2024.xls]Competition Draw'!$I$78 -> White, Shayne | AM52: ='[Competition_Program 2023-2024.xls]Competition Draw'!$K$78 -> 18
E54: vs | H54: ='[Competition_Program 2023-2024.xls]Competition Draw'!$I$102 -> Andrews, Michael | I54: ='[Competition_Program 2023-2024.xls]Competition Draw'!$K$102 -> -31 | AF54: ='[Competition_Program 2023-2024.xls]Competition Draw'!$I$110 -> Sanders, Ian | AG54: ='[Competition_Program 2023-2024.xls]Competition Draw'!$K$110 -> 19 | AI54: vs
B56: ='[Competition_Program 2023-2024.xls]Competition Draw'!$E$71 -> Wilde, David | C56: ='[Competition_Program 2023-2024.xls]Competition Draw'!$G$71 -> 24 | E56: ='[Competition_Program 2023-2024.xls]Competition Draw'!$I$86 -> Andrews, Michael | F56: ='[Competition_Program 2023-2024.xls]Competition Draw'!$K$86 -> -31 | N56: vs | Q56: ='[Competition_Program 2023-2024.xls]Competition Draw'!$I$125 -> . | R56: ='[Competition_Program 2023-2024.xls]Competition Draw'!$K$125 -> . | W56: ='[Competition_Program 2023-2024.xls]Competition Draw'!$I$126 -> . | X56: ='[Competition_Program 2023-2024.xls]Competition Draw'!$K$126 -> . | Z56: vs | AI56: ='[Competition_Program 2023-2024.xls]Competition Draw'!$I$94 -> Somerfield, Benjamin | AJ56: ='[Competition_Program 2023-2024.xls]Competition Draw'!$K$94 -> 3 | AL56: ='[Competition_Program 2023-2024.xls]Competition Draw'!$E$79 -> . | AM56: ='[Competition_Program 2023-2024.xls]Competition Draw'!$G$79 -> .
B58: vs | H58: ='[Competition_Program 2023-2024.xls]Competition Draw'!$E$103 -> Wilde, David | I58: ='[Competition_Program 2023-2024.xls]Competition Draw'!$G$103 -> 24 | AF58: ='[Competition_Program 2023-2024.xls]Competition Draw'!$E$111 -> Lampey, Robert | AG58: ='[Competition_Program 2023-2024.xls]Competition Draw'!$G$111 -> -22 | AL58: vs
B60: ='[Competition_Program 2023-2024.xls]Competition Draw'!$I$71 -> Smith, Des | C60: ='[Competition_Program 2023-2024.xls]Competition Draw'!$K$71 -> -17 | E60: ='[Competition_Program 2023-2024.xls]Competition Draw'!$E$87 -> Chan, Richard | F60: ='[Competition_Program 2023-2024.xls]Competition Draw'!$G$87 -> -13 | H60: vs | K60: ='[Competition_Program 2023-2024.xls]Competition Draw'!$E$116 -> . | L60: ='[Competition_Program 2023-2024.xls]Competition Draw'!$G$116 -> . | AC60: ='[Competition_Program 2023-2024.xls]Competition Draw'!$E$120 -> . | AD60: ='[Competition_Program 2023-2024.xls]Competition Draw'!$G$120 -> . | AF60: vs | AI60: ='[Competition_Program 2023-2024.xls]Competition Draw'!$E$95 -> Digby, Wayne | AJ60: ='[Competition_Program 2023-2024.xls]Competition Draw'!$G$95 -> 22 | AL60: ='[Competition_Program 2023-2024.xls]Competition Draw'!$I$79 -> . | AM60: ='[Competition_Program 2023-2024.xls]Competition Draw'!$K$79 -> .
E62: vs | H62: ='[Competition_Program 2023-2024.xls]Competition Draw'!$I$103 -> Chan, Richard | I62: ='[Competition_Program 2023-2024.xls]Competition Draw'!$K$103 -> -13 | AF62: ='[Competition_Program 2023-2024.xls]Competition Draw'!$I$111 -> . | AG62: ='[Competition_Program 2023-2024.xls]Competition Draw'!$K$111 -> . | AI62: vs
B64: ='[Competition_Program 2023-2024.xls]Competition Draw'!$E$72 -> Motekhasses, Bijan | C64: ='[Competition_Program 2023-2024.xls]Competition Draw'!$G$72 -> -27 | E64: ='[Competition_Program 2023-2024.xls]Competition Draw'!$I$87 -> Deo, Satnam | F64: ='[Competition_Program 2023-2024.xls]Competition Draw'!$K$87 -> -27 | K64: vs | N64: ='[Competition_Program 2023-2024.xls]Competition Draw'!$I$122 -> . | O64: ='[Competition_Program 2023-2024.xls]Competition Draw'!$K$122 -> . | Z64: ='[Competition_Program 2023-2024.xls]Competition Draw'!$I$124 -> . | AA64: ='[Competition_Program 2023-2024.xls]Competition Draw'!$K$124 -> . | AC64: vs | AI64: ='[Competition_Program 2023-2024.xls]Competition Draw'!$I$95 -> Chichester, Andrew | AJ64: ='[Competition_Program 2023-2024.xls]Competition Draw'!$K$95 -> -20 | AL64: ='[Competition_Program 2023-2024.xls]Competition Draw'!$E$80 -> . | AM64: ='[Competition_Program 2023-2024.xls]Competition Draw'!$G$80 -> .
B66: vs | H66: ='[Competition_Program 2023-2024.xls]Competition Draw'!$E$104 -> Spinks, John | I66: ='[Competition_Program 2023-2024.xls]Competition Draw'!$G$104 -> Spinks, John | AF66: ='[Competition_Program 2023-2024.xls]Competition Draw'!$E$112 -> Currie, Steve | AG66: ='[Competition_Program 2023-2024.xls]Competition Draw'!$G$112 -> 21 | AL66: vs
B68: ='[Competition_Program 2023-2024.xls]Competition Draw'!$I$72 -> Spinks, John | C68: ='[Competition_Program 2023-2024.xls]Competition Draw'!$K$72 -> 18 | E68: ='[Competition_Program 2023-2024.xls]Competition Draw'!$E$88 -> Caulfield, Sean | F68: ='[Competition_Program 2023-2024.xls]Competition Draw'!$G$88 -> 28 | H68: vs | K68: ='[Competition_Program 2023-2024.xls]Competition Draw'!$I$116 -> . | L68: ='[Competition_Program 2023-2024.xls]Competition Draw'!$K$116 -> . | AC68: ='[Competition_Program 2023-2024.xls]Competition Draw'!$I$120 -> . | AD68: ='[Competition_Program 2023-2024.xls]Competition Draw'!$K$120 -> . | AF68: vs | AI68: ='[Competition_Program 2023-2024.xls]Competition Draw'!$E$96 -> O'Connor, Rory | AJ68: ='[Competition_Program 2023-2024.xls]Competition Draw'!$G$96 -> 48 | AL68: ='[Competition_Program 2023-2024.xls]Competition Draw'!$I$80 -> . | AM68: ='[Competition_Program 2023-2024.xls]Competition Draw'!$K$80 -> .
E70: vs | H70: ='[Competition_Program 2023-2024.xls]Competition Draw'!$I$104 -> Caulfield, Sean | I70: ='[Competition_Program 2023-2024.xls]Competition Draw'!$K$104 -> 28 | AF70: ='[Competition_Program 2023-2024.xls]Competition Draw'!$I$112 -> O'Connor, Rory | AG70: ='[Competition_Program 2023-2024.xls]Competition Draw'!$K$112 -> 48 | AI70: vs
E72: ='[Competition_Program 2023-2024.xls]Competition Draw'!$I$88 -> Hale, Lee | F72: ='[Competition_Program 2023-2024.xls]Competition Draw'!$K$88 -> 51 | AI72: ='[Competition_Program 2023-2024.xls]Competition Draw'!$I$96 -> Lightfoot, Neil | AJ72: ='[Competition_Program 2023-2024.xls]Competition Draw'!$K$96 -> 7
A74: Note : Name followed by an accent (^) , denotes that the player claimed the match and was awarded a win at a Committee meeting,
A75: Note: Name followed by an asterisk (*), denotes that the player has been awarded a 'win' by the toss of a coin at a Committee meeting