A2: WGC & District Billiards and Snooker League
A3: Snooker Doubles Handicap
B5: =E5&"+" -> Round 1+ | E5: ='[Competition_Program 2023-2024.xls]Run Program'!$C$9 -> Round 1 | H5: ='[Competition_Program 2023-2024.xls]Run Program'!$C$10 -> Round 2 | K5: ='[Competition_Program 2023-2024.xls]Run Program'!$C$11 -> Round 3 | N5: ='[Competition_Program 2023-2024.xls]Run Program'!$C$12 -> Quarter Final | Q5: ='[Competition_Program 2023-2024.xls]Run Program'!$C$13 -> Semi Final | T5: ='[Competition_Program 2023-2024.xls]Run Program'!$C$14 -> Final | W5: ='[Competition_Program 2023-2024.xls]Run Program'!$C$13 -> Semi Final | Z5: ='[Competition_Program 2023-2024.xls]Run Program'!$C$12 -> Quarter Final | AC5: ='[Competition_Program 2023-2024.xls]Run Program'!$C$11 -> Round 3 | AF5: ='[Competition_Program 2023-2024.xls]Run Program'!$C$10 -> Round 2 | AI5: ='[Competition_Program 2023-2024.xls]Run Program'!$C$9 -> Round 1 | AL5: =AI5&"+" -> Round 1+
E6: Play by | H6: Play by | K6: Play by | N6: Play by | Q6: Play by | T6: Play by | W6: Play by | Z6: Play by | AC6: Play by | AF6: Play by | AI6: Play by
E7: ='[Competition_Program 2023-2024.xls]Run Program'!$D$9 -> 45228 | H7: ='[Competition_Program 2023-2024.xls]Run Program'!$D$10 -> 45263 | K7: ='[Competition_Program 2023-2024.xls]Run Program'!$D$11 -> 45319 | N7: ='[Competition_Program 2023-2024.xls]Run Program'!$D$12 -> 45354 | Q7: ='[Competition_Program 2023-2024.xls]Run Program'!$D$13 -> 45379 | T7: ='[Competition_Program 2023-2024.xls]Run Program'!$D$14 -> 45410 | W7: ='[Competition_Program 2023-2024.xls]Run Program'!$D$13 -> 45379 | Z7: ='[Competition_Program 2023-2024.xls]Run Program'!$D$12 -> 45354 | AC7: ='[Competition_Program 2023-2024.xls]Run Program'!$D$11 -> 45319 | AF7: ='[Competition_Program 2023-2024.xls]Run Program'!$D$10 -> 45263 | AI7: ='[Competition_Program 2023-2024.xls]Run Program'!$D$9 -> 45228
B8: ='[Competition_Program 2023-2024.xls]Competition Draw'!$E$191 -> . | C8: ='[Competition_Program 2023-2024.xls]Competition Draw'!$G$191 -> . | E8: ='[Competition_Program 2023-2024.xls]Run Program'!$S$10 -> Best of 3 | H8: ='[Competition_Program 2023-2024.xls]Run Program'!$S$13 -> Best of 3 | K8: ='[Competition_Program 2023-2024.xls]Run Program'!$S$16 -> Best of 3 | N8: ='[Competition_Program 2023-2024.xls]Run Program'!$S$19 -> Best of 3 | Q8: ='[Competition_Program 2023-2024.xls]Run Program'!$S$22 -> Best of 3 | T8: ='[Competition_Program 2023-2024.xls]Run Program'!$S$25 -> Best of 5 | W8: ='[Competition_Program 2023-2024.xls]Run Program'!$S$28 -> Best of 3 | Z8: ='[Competition_Program 2023-2024.xls]Run Program'!$S$31 -> Best of 3 | AC8: ='[Competition_Program 2023-2024.xls]Run Program'!$S$34 -> Best of 3 | AF8: ='[Competition_Program 2023-2024.xls]Run Program'!$S$37 -> Best of 3 | AI8: ='[Competition_Program 2023-2024.xls]Run Program'!$S$40 -> Best of 3 | AL8: ='[Competition_Program 2023-2024.xls]Competition Draw'!$E$199 -> . | AM8: ='[Competition_Program 2023-2024.xls]Competition Draw'!$G$199 -> .
B9: ='[Competition_Program 2023-2024.xls]Competition Draw'!$F$191 -> . | AL9: ='[Competition_Program 2023-2024.xls]Competition Draw'!$F$199 -> .
B10: vs | H10: ='[Competition_Program 2023-2024.xls]Competition Draw'!$E$223 -> Grant, Paul | I10: ='[Competition_Program 2023-2024.xls]Competition Draw'!$G$223 -> 11 | AF10: ='[Competition_Program 2023-2024.xls]Competition Draw'!$E$231 -> . | AG10: ='[Competition_Program 2023-2024.xls]Competition Draw'!$G$231 -> . | AL10: vs
H11: ='[Competition_Program 2023-2024.xls]Competition Draw'!$F$223 -> Locke, Mike | AF11: ='[Competition_Program 2023-2024.xls]Competition Draw'!$F$231 -> .
B12: ='[Competition_Program 2023-2024.xls]Competition Draw'!$I$191 -> . | C12: ='[Competition_Program 2023-2024.xls]Competition Draw'!$K$191 -> . | E12: ='[Competition_Program 2023-2024.xls]Competition Draw'!$E$207 -> . | F12: ='[Competition_Program 2023-2024.xls]Competition Draw'!$G$207 -> . | H12: vs | K12: ='[Competition_Program 2023-2024.xls]Competition Draw'!$E$239 -> . | L12: ='[Competition_Program 2023-2024.xls]Competition Draw'!$G$239 -> . | AC12: ='[Competition_Program 2023-2024.xls]Competition Draw'!$E$243 -> Lund, Simon | AD12: ='[Competition_Program 2023-2024.xls]Competition Draw'!$G$243 -> 12 | AF12: vs | AI12: ='[Competition_Program 2023-2024.xls]Competition Draw'!$E$215 -> . | AJ12: ='[Competition_Program 2023-2024.xls]Competition Draw'!$G$215 -> . | AL12: ='[Competition_Program 2023-2024.xls]Competition Draw'!$I$199 -> . | AM12: ='[Competition_Program 2023-2024.xls]Competition Draw'!$K$199 -> .
B13: ='[Competition_Program 2023-2024.xls]Competition Draw'!$J$191 -> . | E13: ='[Competition_Program 2023-2024.xls]Competition Draw'!$F$207 -> . | K13: ='[Competition_Program 2023-2024.xls]Competition Draw'!$F$239 -> . | AC13: ='[Competition_Program 2023-2024.xls]Competition Draw'!$F$243 -> Potts, John | AI13: ='[Competition_Program 2023-2024.xls]Competition Draw'!$F$215 -> . | AL13: ='[Competition_Program 2023-2024.xls]Competition Draw'!$J$199 -> .
E14: vs | H14: ='[Competition_Program 2023-2024.xls]Competition Draw'!$I$223 -> Andrews, Michael | I14: ='[Competition_Program 2023-2024.xls]Competition Draw'!$K$223 -> -15 | AF14: ='[Competition_Program 2023-2024.xls]Competition Draw'!$I$231 -> . | AG14: ='[Competition_Program 2023-2024.xls]Competition Draw'!$K$231 -> . | AI14: vs
H15: ='[Competition_Program 2023-2024.xls]Competition Draw'!$J$223 -> Andrews, Stephen | AF15: ='[Competition_Program 2023-2024.xls]Competition Draw'!$J$231 -> .
B16: ='[Competition_Program 2023-2024.xls]Competition Draw'!$E$192 -> . | C16: ='[Competition_Program 2023-2024.xls]Competition Draw'!$G$192 -> . | E16: ='[Competition_Program 2023-2024.xls]Competition Draw'!$I$207 -> . | F16: ='[Competition_Program 2023-2024.xls]Competition Draw'!$K$207 -> . | K16: vs | N16: ='[Competition_Program 2023-2024.xls]Competition Draw'!$E$247 -> . | O16: ='[Competition_Program 2023-2024.xls]Competition Draw'!$G$247 -> . | Z16: ='[Competition_Program 2023-2024.xls]Competition Draw'!$E$249 -> . | AA16: ='[Competition_Program 2023-2024.xls]Competition Draw'!$G$249 -> . | AC16: vs | AI16: ='[Competition_Program 2023-2024.xls]Competition Draw'!$I$215 -> . | AJ16: ='[Competition_Program 2023-2024.xls]Competition Draw'!$K$215 -> . | AL16: ='[Competition_Program 2023-2024.xls]Competition Draw'!$E$200 -> . | AM16: ='[Competition_Program 2023-2024.xls]Competition Draw'!$G$200 -> .
B17: ='[Competition_Program 2023-2024.xls]Competition Draw'!$F$192 -> . | E17: ='[Competition_Program 2023-2024.xls]Competition Draw'!$J$207 -> . | N17: ='[Competition_Program 2023-2024.xls]Competition Draw'!$F$247 -> . | Z17: ='[Competition_Program 2023-2024.xls]Competition Draw'!$F$249 -> . | AI17: ='[Competition_Program 2023-2024.xls]Competition Draw'!$J$215 -> . | AL17: ='[Competition_Program 2023-2024.xls]Competition Draw'!$F$200 -> .
B18: vs | H18: ='[Competition_Program 2023-2024.xls]Competition Draw'!$E$224 -> Deo, Satnam | I18: ='[Competition_Program 2023-2024.xls]Competition Draw'!$G$224 -> -25 | AF18: ='[Competition_Program 2023-2024.xls]Competition Draw'!$E$232 -> Reade, Gordon | AG18: ='[Competition_Program 2023-2024.xls]Competition Draw'!$G$232 -> -2 | AL18: vs
H19: ='[Competition_Program 2023-2024.xls]Competition Draw'!$F$224 -> Sachs, Kim | AF19: ='[Competition_Program 2023-2024.xls]Competition Draw'!$F$232 -> Reade, Liam
B20: ='[Competition_Program 2023-2024.xls]Competition Draw'!$I$192 -> . | C20: ='[Competition_Program 2023-2024.xls]Competition Draw'!$K$192 -> . | E20: ='[Competition_Program 2023-2024.xls]Competition Draw'!$E$208 -> . | F20: ='[Competition_Program 2023-2024.xls]Competition Draw'!$G$208 -> . | H20: vs | K20: ='[Competition_Program 2023-2024.xls]Competition Draw'!$I$239 -> . | L20: ='[Competition_Program 2023-2024.xls]Competition Draw'!$K$239 -> . | AC20: ='[Competition_Program 2023-2024.xls]Competition Draw'!$I$243 -> . | AD20: ='[Competition_Program 2023-2024.xls]Competition Draw'!$K$243 -> . | AF20: vs | AI20: ='[Competition_Program 2023-2024.xls]Competition Draw'!$E$216 -> . | AJ20: ='[Competition_Program 2023-2024.xls]Competition Draw'!$G$216 -> . | AL20: ='[Competition_Program 2023-2024.xls]Competition Draw'!$I$200 -> . | AM20: ='[Competition_Program 2023-2024.xls]Competition Draw'!$K$200 -> .
B21: ='[Competition_Program 2023-2024.xls]Competition Draw'!$J$192 -> . | E21: ='[Competition_Program 2023-2024.xls]Competition Draw'!$F$208 -> . | K21: ='[Competition_Program 2023-2024.xls]Competition Draw'!$J$239 -> . | AC21: ='[Competition_Program 2023-2024.xls]Competition Draw'!$J$243 -> . | AI21: ='[Competition_Program 2023-2024.xls]Competition Draw'!$F$216 -> . | AL21: ='[Competition_Program 2023-2024.xls]Competition Draw'!$J$200 -> .
E22: vs | H22: ='[Competition_Program 2023-2024.xls]Competition Draw'!$I$224 -> Shaw, Benjamin | I22: ='[Competition_Program 2023-2024.xls]Competition Draw'!$K$224 -> 18 | AF22: ='[Competition_Program 2023-2024.xls]Competition Draw'!$I$232 -> O'Connor, Paul | AG22: ='[Competition_Program 2023-2024.xls]Competition Draw'!$K$232 -> 21 | AI22: vs
H23: ='[Competition_Program 2023-2024.xls]Competition Draw'!$J$224 -> Merrifield, Philip | AF23: ='[Competition_Program 2023-2024.xls]Competition Draw'!$J$232 -> O'Connor, Rory
B24: ='[Competition_Program 2023-2024.xls]Competition Draw'!$E$193 -> . | C24: ='[Competition_Program 2023-2024.xls]Competition Draw'!$G$193 -> . | E24: ='[Competition_Program 2023-2024.xls]Competition Draw'!$I$208 -> . | F24: ='[Competition_Program 2023-2024.xls]Competition Draw'!$K$208 -> . | N24: vs | Q24: ='[Competition_Program 2023-2024.xls]Competition Draw'!$E$251 -> . | R24: ='[Competition_Program 2023-2024.xls]Competition Draw'!$G$251 -> . | W24: ='[Competition_Program 2023-2024.xls]Competition Draw'!$E$252 -> . | X24: ='[Competition_Program 2023-2024.xls]Competition Draw'!$G$252 -> . | Z24: vs | AI24: ='[Competition_Program 2023-2024.xls]Competition Draw'!$I$216 -> . | AJ24: ='[Competition_Program 2023-2024.xls]Competition Draw'!$K$216 -> . | AL24: ='[Competition_Program 2023-2024.xls]Competition Draw'!$E$201 -> . | AM24: ='[Competition_Program 2023-2024.xls]Competition Draw'!$G$201 -> .
B25: ='[Competition_Program 2023-2024.xls]Competition Draw'!$F$193 -> . | E25: ='[Competition_Program 2023-2024.xls]Competition Draw'!$J$208 -> . | Q25: ='[Competition_Program 2023-2024.xls]Competition Draw'!$F$251 -> . | W25: ='[Competition_Program 2023-2024.xls]Competition Draw'!$F$252 -> . | AI25: ='[Competition_Program 2023-2024.xls]Competition Draw'!$J$216 -> . | AL25: ='[Competition_Program 2023-2024.xls]Competition Draw'!$F$201 -> .
B26: vs | H26: ='[Competition_Program 2023-2024.xls]Competition Draw'!$E$225 -> Motekhasses, Bijan | I26: ='[Competition_Program 2023-2024.xls]Competition Draw'!$G$225 -> -12 | AF26: ='[Competition_Program 2023-2024.xls]Competition Draw'!$E$233 -> Kightley, Oliver | AG26: ='[Competition_Program 2023-2024.xls]Competition Draw'!$G$233 -> -5 | AL26: vs
H27: ='[Competition_Program 2023-2024.xls]Competition Draw'!$F$225 -> Payne, Mark | AF27: ='[Competition_Program 2023-2024.xls]Competition Draw'!$F$233 -> Wilde, David
B28: ='[Competition_Program 2023-2024.xls]Competition Draw'!$I$193 -> . | C28: ='[Competition_Program 2023-2024.xls]Competition Draw'!$K$193 -> . | E28: ='[Competition_Program 2023-2024.xls]Competition Draw'!$E$209 -> . | F28: ='[Competition_Program 2023-2024.xls]Competition Draw'!$G$209 -> . | H28: vs | K28: ='[Competition_Program 2023-2024.xls]Competition Draw'!$E$240 -> . | L28: ='[Competition_Program 2023-2024.xls]Competition Draw'!$G$240 -> . | AC28: ='[Competition_Program 2023-2024.xls]Competition Draw'!$E$244 -> . | AD28: ='[Competition_Program 2023-2024.xls]Competition Draw'!$G$244 -> . | AF28: vs | AI28: ='[Competition_Program 2023-2024.xls]Competition Draw'!$E$217 -> . | AJ28: ='[Competition_Program 2023-2024.xls]Competition Draw'!$G$217 -> . | AL28: ='[Competition_Program 2023-2024.xls]Competition Draw'!$I$201 -> . | AM28: ='[Competition_Program 2023-2024.xls]Competition Draw'!$K$201 -> .
B29: ='[Competition_Program 2023-2024.xls]Competition Draw'!$J$193 -> . | E29: ='[Competition_Program 2023-2024.xls]Competition Draw'!$F$209 -> . | K29: ='[Competition_Program 2023-2024.xls]Competition Draw'!$F$240 -> . | AC29: ='[Competition_Program 2023-2024.xls]Competition Draw'!$F$244 -> . | AI29: ='[Competition_Program 2023-2024.xls]Competition Draw'!$F$217 -> . | AL29: ='[Competition_Program 2023-2024.xls]Competition Draw'!$J$201 -> .
E30: vs | H30: ='[Competition_Program 2023-2024.xls]Competition Draw'!$I$225 -> Doocey, Liam | I30: ='[Competition_Program 2023-2024.xls]Competition Draw'!$K$225 -> -5 | AF30: ='[Competition_Program 2023-2024.xls]Competition Draw'!$I$233 -> Chapman, Bob | AG30: ='[Competition_Program 2023-2024.xls]Competition Draw'!$K$233 -> 5 | AI30: vs
H31: ='[Competition_Program 2023-2024.xls]Competition Draw'!$J$225 -> Herdman, Andy | AF31: ='[Competition_Program 2023-2024.xls]Competition Draw'!$J$233 -> Cheriton, Che
B32: ='[Competition_Program 2023-2024.xls]Competition Draw'!$E$194 -> . | C32: ='[Competition_Program 2023-2024.xls]Competition Draw'!$G$194 -> . | E32: ='[Competition_Program 2023-2024.xls]Competition Draw'!$I$209 -> . | F32: ='[Competition_Program 2023-2024.xls]Competition Draw'!$K$209 -> . | K32: vs | N32: ='[Competition_Program 2023-2024.xls]Competition Draw'!$I$247 -> . | O32: ='[Competition_Program 2023-2024.xls]Competition Draw'!$K$247 -> . | Z32: ='[Competition_Program 2023-2024.xls]Competition Draw'!$I$249 -> . | AA32: ='[Competition_Program 2023-2024.xls]Competition Draw'!$K$249 -> . | AC32: vs | AI32: ='[Competition_Program 2023-2024.xls]Competition Draw'!$I$217 -> . | AJ32: ='[Competition_Program 2023-2024.xls]Competition Draw'!$K$217 -> . | AL32: ='[Competition_Program 2023-2024.xls]Competition Draw'!$E$202 -> . | AM32: ='[Competition_Program 2023-2024.xls]Competition Draw'!$G$202 -> .
B33: ='[Competition_Program 2023-2024.xls]Competition Draw'!$F$194 -> . | E33: ='[Competition_Program 2023-2024.xls]Competition Draw'!$J$209 -> . | N33: ='[Competition_Program 2023-2024.xls]Competition Draw'!$J$247 -> . | Z33: ='[Competition_Program 2023-2024.xls]Competition Draw'!$J$249 -> . | AI33: ='[Competition_Program 2023-2024.xls]Competition Draw'!$J$217 -> . | AL33: ='[Competition_Program 2023-2024.xls]Competition Draw'!$F$202 -> .
B34: vs | H34: ='[Competition_Program 2023-2024.xls]Competition Draw'!$E$226 -> Patel, Hemant | I34: ='[Competition_Program 2023-2024.xls]Competition Draw'!$G$226 -> 16 | AF34: ='[Competition_Program 2023-2024.xls]Competition Draw'!$E$234 -> Lightfoot, Neil | AG34: ='[Competition_Program 2023-2024.xls]Competition Draw'!$G$234 -> 11 | AL34: vs
H35: ='[Competition_Program 2023-2024.xls]Competition Draw'!$F$226 -> Soderberg, Scott | AF35: ='[Competition_Program 2023-2024.xls]Competition Draw'!$F$234 -> Tehrani, Ali
B36: ='[Competition_Program 2023-2024.xls]Competition Draw'!$I$194 -> . | C36: ='[Competition_Program 2023-2024.xls]Competition Draw'!$K$194 -> . | E36: ='[Competition_Program 2023-2024.xls]Competition Draw'!$E$210 -> . | F36: ='[Competition_Program 2023-2024.xls]Competition Draw'!$G$210 -> . | H36: vs | K36: ='[Competition_Program 2023-2024.xls]Competition Draw'!$I$240 -> . | L36: ='[Competition_Program 2023-2024.xls]Competition Draw'!$K$240 -> . | T36: ='[Competition_Program 2023-2024.xls]Competition Draw'!$E$253 -> . | U36: ='[Competition_Program 2023-2024.xls]Competition Draw'!$G$253 -> . | AC36: ='[Competition_Program 2023-2024.xls]Competition Draw'!$I$244 -> . | AD36: ='[Competition_Program 2023-2024.xls]Competition Draw'!$K$244 -> . | AF36: vs | AI36: ='[Competition_Program 2023-2024.xls]Competition Draw'!$E$218 -> . | AJ36: ='[Competition_Program 2023-2024.xls]Competition Draw'!$G$218 -> . | AL36: ='[Competition_Program 2023-2024.xls]Competition Draw'!$I$202 -> . | AM36: ='[Competition_Program 2023-2024.xls]Competition Draw'!$K$202 -> .
B37: ='[Competition_Program 2023-2024.xls]Competition Draw'!$J$194 -> . | E37: ='[Competition_Program 2023-2024.xls]Competition Draw'!$F$210 -> . | K37: ='[Competition_Program 2023-2024.xls]Competition Draw'!$J$240 -> . | T37: ='[Competition_Program 2023-2024.xls]Competition Draw'!$F$253 -> . | AC37: ='[Competition_Program 2023-2024.xls]Competition Draw'!$J$244 -> . | AI37: ='[Competition_Program 2023-2024.xls]Competition Draw'!$F$218 -> . | AL37: ='[Competition_Program 2023-2024.xls]Competition Draw'!$J$202 -> .
E38: vs | H38: ='[Competition_Program 2023-2024.xls]Competition Draw'!$I$226 -> Elias, Iyad | I38: ='[Competition_Program 2023-2024.xls]Competition Draw'!$K$226 -> -16 | AF38: ='[Competition_Program 2023-2024.xls]Competition Draw'!$I$234 -> Bonner, Kevin | AG38: ='[Competition_Program 2023-2024.xls]Competition Draw'!$K$234 -> 14 | AI38: vs
H39: ='[Competition_Program 2023-2024.xls]Competition Draw'!$J$226 -> Miller, Stephen | T39: Winners | AF39: ='[Competition_Program 2023-2024.xls]Competition Draw'!$J$234 -> Hampton, Stephen
B40: ='[Competition_Program 2023-2024.xls]Competition Draw'!$E$195 -> . | C40: ='[Competition_Program 2023-2024.xls]Competition Draw'!$G$195 -> . | E40: ='[Competition_Program 2023-2024.xls]Competition Draw'!$I$210 -> . | F40: ='[Competition_Program 2023-2024.xls]Competition Draw'!$K$210 -> . | Q40: vs | T40: ='[Competition_Program 2023-2024.xls]Competition Draw'!$M$253 -> . | W40: vs | AI40: ='[Competition_Program 2023-2024.xls]Competition Draw'!$I$218 -> . | AJ40: ='[Competition_Program 2023-2024.xls]Competition Draw'!$K$218 -> . | AL40: ='[Competition_Program 2023-2024.xls]Competition Draw'!$E$203 -> . | AM40: ='[Competition_Program 2023-2024.xls]Competition Draw'!$G$203 -> .
B41: ='[Competition_Program 2023-2024.xls]Competition Draw'!$F$195 -> . | E41: ='[Competition_Program 2023-2024.xls]Competition Draw'!$J$210 -> . | T41: ='[Competition_Program 2023-2024.xls]Competition Draw'!$N$253 -> . | AI41: ='[Competition_Program 2023-2024.xls]Competition Draw'!$J$218 -> . | AL41: ='[Competition_Program 2023-2024.xls]Competition Draw'!$F$203 -> .
B42: vs | H42: ='[Competition_Program 2023-2024.xls]Competition Draw'!$E$227 -> Brunel, Nick | I42: ='[Competition_Program 2023-2024.xls]Competition Draw'!$G$227 -> 27 | AF42: ='[Competition_Program 2023-2024.xls]Competition Draw'!$E$235 -> Caulfield, Sean | AG42: ='[Competition_Program 2023-2024.xls]Competition Draw'!$G$235 -> 22 | AL42: vs
H43: ='[Competition_Program 2023-2024.xls]Competition Draw'!$F$227 -> Digby, Wayne | AF43: ='[Competition_Program 2023-2024.xls]Competition Draw'!$F$235 -> Feuell, Mark
B44: ='[Competition_Program 2023-2024.xls]Competition Draw'!$I$195 -> . | C44: ='[Competition_Program 2023-2024.xls]Competition Draw'!$K$195 -> . | E44: ='[Competition_Program 2023-2024.xls]Competition Draw'!$E$211 -> . | F44: ='[Competition_Program 2023-2024.xls]Competition Draw'!$G$211 -> . | H44: vs | K44: ='[Competition_Program 2023-2024.xls]Competition Draw'!$E$241 -> . | L44: ='[Competition_Program 2023-2024.xls]Competition Draw'!$G$241 -> . | T44: ='[Competition_Program 2023-2024.xls]Competition Draw'!$I$253 -> . | U44: ='[Competition_Program 2023-2024.xls]Competition Draw'!$K$253 -> . | AC44: ='[Competition_Program 2023-2024.xls]Competition Draw'!$E$245 -> . | AD44: ='[Competition_Program 2023-2024.xls]Competition Draw'!$G$245 -> . | AF44: vs | AI44: ='[Competition_Program 2023-2024.xls]Competition Draw'!$E$219 -> . | AJ44: ='[Competition_Program 2023-2024.xls]Competition Draw'!$G$219 -> . | AL44: ='[Competition_Program 2023-2024.xls]Competition Draw'!$I$203 -> . | AM44: ='[Competition_Program 2023-2024.xls]Competition Draw'!$K$203 -> .
B45: ='[Competition_Program 2023-2024.xls]Competition Draw'!$J$195 -> . | E45: ='[Competition_Program 2023-2024.xls]Competition Draw'!$F$211 -> . | K45: ='[Competition_Program 2023-2024.xls]Competition Draw'!$F$241 -> . | T45: ='[Competition_Program 2023-2024.xls]Competition Draw'!$J$253 -> . | AC45: ='[Competition_Program 2023-2024.xls]Competition Draw'!$F$245 -> . | AI45: ='[Competition_Program 2023-2024.xls]Competition Draw'!$F$219 -> . | AL45: ='[Competition_Program 2023-2024.xls]Competition Draw'!$J$203 -> .
E46: vs | H46: ='[Competition_Program 2023-2024.xls]Competition Draw'!$I$227 -> Currie, Steve | I46: ='[Competition_Program 2023-2024.xls]Competition Draw'!$K$227 -> 14 | AF46: ='[Competition_Program 2023-2024.xls]Competition Draw'!$I$235 -> Lampey, Robert | AG46: ='[Competition_Program 2023-2024.xls]Competition Draw'!$K$235 -> -2 | AI46: vs
H47: ='[Competition_Program 2023-2024.xls]Competition Draw'!$J$227 -> Hilborne, Steve | AF47: ='[Competition_Program 2023-2024.xls]Competition Draw'!$J$235 -> Spinks, John
B48: ='[Competition_Program 2023-2024.xls]Competition Draw'!$E$196 -> . | C48: ='[Competition_Program 2023-2024.xls]Competition Draw'!$G$196 -> . | E48: ='[Competition_Program 2023-2024.xls]Competition Draw'!$I$211 -> . | F48: ='[Competition_Program 2023-2024.xls]Competition Draw'!$K$211 -> . | K48: vs | N48: ='[Competition_Program 2023-2024.xls]Competition Draw'!$E$248 -> . | O48: ='[Competition_Program 2023-2024.xls]Competition Draw'!$G$248 -> . | Z48: ='[Competition_Program 2023-2024.xls]Competition Draw'!$E$250 -> . | AA48: ='[Competition_Program 2023-2024.xls]Competition Draw'!$G$250 -> . | AC48: vs | AI48: ='[Competition_Program 2023-2024.xls]Competition Draw'!$I$219 -> . | AJ48: ='[Competition_Program 2023-2024.xls]Competition Draw'!$K$219 -> . | AL48: ='[Competition_Program 2023-2024.xls]Competition Draw'!$E$204 -> . | AM48: ='[Competition_Program 2023-2024.xls]Competition Draw'!$G$204 -> .
B49: ='[Competition_Program 2023-2024.xls]Competition Draw'!$F$196 -> . | E49: ='[Competition_Program 2023-2024.xls]Competition Draw'!$J$211 -> . | N49: ='[Competition_Program 2023-2024.xls]Competition Draw'!$F$248 -> . | Z49: ='[Competition_Program 2023-2024.xls]Competition Draw'!$F$250 -> . | AI49: ='[Competition_Program 2023-2024.xls]Competition Draw'!$J$219 -> . | AL49: ='[Competition_Program 2023-2024.xls]Competition Draw'!$F$204 -> .
B50: vs | H50: ='[Competition_Program 2023-2024.xls]Competition Draw'!$E$228 -> Cartwright, Bob | I50: ='[Competition_Program 2023-2024.xls]Competition Draw'!$G$228 -> 23 | AF50: ='[Competition_Program 2023-2024.xls]Competition Draw'!$E$236 -> Cooper, Denis | AG50: ='[Competition_Program 2023-2024.xls]Competition Draw'!$G$236 -> 45 | AL50: vs
H51: ='[Competition_Program 2023-2024.xls]Competition Draw'!$F$228 -> Marchese, Joe | AF51: ='[Competition_Program 2023-2024.xls]Competition Draw'!$F$236 -> Thompson, Jim
B52: ='[Competition_Program 2023-2024.xls]Competition Draw'!$I$196 -> . | C52: ='[Competition_Program 2023-2024.xls]Competition Draw'!$K$196 -> . | E52: ='[Competition_Program 2023-2024.xls]Competition Draw'!$E$212 -> . | F52: ='[Competition_Program 2023-2024.xls]Competition Draw'!$G$212 -> . | H52: vs | K52: ='[Competition_Program 2023-2024.xls]Competition Draw'!$I$241 -> . | L52: ='[Competition_Program 2023-2024.xls]Competition Draw'!$K$241 -> . | AC52: ='[Competition_Program 2023-2024.xls]Competition Draw'!$I$245 -> . | AD52: ='[Competition_Program 2023-2024.xls]Competition Draw'!$K$245 -> . | AF52: vs | AI52: ='[Competition_Program 2023-2024.xls]Competition Draw'!$E$220 -> . | AJ52: ='[Competition_Program 2023-2024.xls]Competition Draw'!$G$220 -> . | AL52: ='[Competition_Program 2023-2024.xls]Competition Draw'!$I$204 -> . | AM52: ='[Competition_Program 2023-2024.xls]Competition Draw'!$K$204 -> .
B53: ='[Competition_Program 2023-2024.xls]Competition Draw'!$J$196 -> . | E53: ='[Competition_Program 2023-2024.xls]Competition Draw'!$F$212 -> . | K53: ='[Competition_Program 2023-2024.xls]Competition Draw'!$J$241 -> . | AC53: ='[Competition_Program 2023-2024.xls]Competition Draw'!$J$245 -> . | AI53: ='[Competition_Program 2023-2024.xls]Competition Draw'!$F$220 -> . | AL53: ='[Competition_Program 2023-2024.xls]Competition Draw'!$J$204 -> .
E54: vs | H54: ='[Competition_Program 2023-2024.xls]Competition Draw'!$I$228 -> Hodgson, Nick | I54: ='[Competition_Program 2023-2024.xls]Competition Draw'!$K$228 -> 11 | AF54: ='[Competition_Program 2023-2024.xls]Competition Draw'!$I$236 -> Paterson-Proto, Jordan | AG54: ='[Competition_Program 2023-2024.xls]Competition Draw'!$K$236 -> -21 | AI54: vs
H55: ='[Competition_Program 2023-2024.xls]Competition Draw'!$J$228 -> Warner, Peter | AF55: ='[Competition_Program 2023-2024.xls]Competition Draw'!$J$236 -> Pilborough, Mark
B56: ='[Competition_Program 2023-2024.xls]Competition Draw'!$E$197 -> . | C56: ='[Competition_Program 2023-2024.xls]Competition Draw'!$G$197 -> . | E56: ='[Competition_Program 2023-2024.xls]Competition Draw'!$I$212 -> . | F56: ='[Competition_Program 2023-2024.xls]Competition Draw'!$K$212 -> . | N56: vs | Q56: ='[Competition_Program 2023-2024.xls]Competition Draw'!$I$251 -> . | R56: ='[Competition_Program 2023-2024.xls]Competition Draw'!$K$251 -> . | W56: ='[Competition_Program 2023-2024.xls]Competition Draw'!$I$252 -> . | X56: ='[Competition_Program 2023-2024.xls]Competition Draw'!$K$252 -> . | Z56: vs | AI56: ='[Competition_Program 2023-2024.xls]Competition Draw'!$I$220 -> . | AJ56: ='[Competition_Program 2023-2024.xls]Competition Draw'!$K$220 -> . | AL56: ='[Competition_Program 2023-2024.xls]Competition Draw'!$E$205 -> . | AM56: ='[Competition_Program 2023-2024.xls]Competition Draw'!$G$205 -> .
B57: ='[Competition_Program 2023-2024.xls]Competition Draw'!$F$197 -> . | E57: ='[Competition_Program 2023-2024.xls]Competition Draw'!$J$212 -> . | Q57: ='[Competition_Program 2023-2024.xls]Competition Draw'!$J$251 -> . | W57: ='[Competition_Program 2023-2024.xls]Competition Draw'!$J$252 -> . | AI57: ='[Competition_Program 2023-2024.xls]Competition Draw'!$J$220 -> . | AL57: ='[Competition_Program 2023-2024.xls]Competition Draw'!$F$205 -> .
B58: vs | H58: ='[Competition_Program 2023-2024.xls]Competition Draw'!$E$229 -> Alger, Alan | I58: ='[Competition_Program 2023-2024.xls]Competition Draw'!$G$229 -> -11 | AF58: ='[Competition_Program 2023-2024.xls]Competition Draw'!$E$237 -> Atherley, Ryan | AG58: ='[Competition_Program 2023-2024.xls]Competition Draw'!$G$237 -> 17 | AL58: vs
H59: ='[Competition_Program 2023-2024.xls]Competition Draw'!$F$229 -> Taylor, Jamie | AF59: ='[Competition_Program 2023-2024.xls]Competition Draw'!$F$237 -> O'Neill, Steve
B60: ='[Competition_Program 2023-2024.xls]Competition Draw'!$I$197 -> . | C60: ='[Competition_Program 2023-2024.xls]Competition Draw'!$K$197 -> . | E60: ='[Competition_Program 2023-2024.xls]Competition Draw'!$E$213 -> . | F60: ='[Competition_Program 2023-2024.xls]Competition Draw'!$G$213 -> . | H60: vs | K60: ='[Competition_Program 2023-2024.xls]Competition Draw'!$E$242 -> . | L60: ='[Competition_Program 2023-2024.xls]Competition Draw'!$G$242 -> . | AC60: ='[Competition_Program 2023-2024.xls]Competition Draw'!$E$246 -> . | AD60: ='[Competition_Program 2023-2024.xls]Competition Draw'!$G$246 -> . | AF60: vs | AI60: ='[Competition_Program 2023-2024.xls]Competition Draw'!$E$221 -> . | AJ60: ='[Competition_Program 2023-2024.xls]Competition Draw'!$G$221 -> . | AL60: ='[Competition_Program 2023-2024.xls]Competition Draw'!$I$205 -> . | AM60: ='[Competition_Program 2023-2024.xls]Competition Draw'!$K$205 -> .
B61: ='[Competition_Program 2023-2024.xls]Competition Draw'!$J$197 -> . | E61: ='[Competition_Program 2023-2024.xls]Competition Draw'!$F$213 -> . | K61: ='[Competition_Program 2023-2024.xls]Competition Draw'!$F$242 -> . | AC61: ='[Competition_Program 2023-2024.xls]Competition Draw'!$F$246 -> . | AI61: ='[Competition_Program 2023-2024.xls]Competition Draw'!$F$221 -> . | AL61: ='[Competition_Program 2023-2024.xls]Competition Draw'!$J$205 -> .
E62: vs | H62: ='[Competition_Program 2023-2024.xls]Competition Draw'!$I$229 -> Ebbs, John | I62: ='[Competition_Program 2023-2024.xls]Competition Draw'!$K$229 -> -6 | AF62: ='[Competition_Program 2023-2024.xls]Competition Draw'!$I$237 -> Gibbs, Steve | AG62: ='[Competition_Program 2023-2024.xls]Competition Draw'!$K$237 -> -41 | AI62: vs
H63: ='[Competition_Program 2023-2024.xls]Competition Draw'!$J$229 -> Grainger, Martin | AF63: ='[Competition_Program 2023-2024.xls]Competition Draw'!$J$237 -> Powell, Rob
B64: ='[Competition_Program 2023-2024.xls]Competition Draw'!$E$198 -> . | C64: ='[Competition_Program 2023-2024.xls]Competition Draw'!$G$198 -> . | E64: ='[Competition_Program 2023-2024.xls]Competition Draw'!$I$213 -> . | F64: ='[Competition_Program 2023-2024.xls]Competition Draw'!$K$213 -> . | K64: vs | N64: ='[Competition_Program 2023-2024.xls]Competition Draw'!$I$248 -> . | O64: ='[Competition_Program 2023-2024.xls]Competition Draw'!$K$248 -> . | Z64: ='[Competition_Program 2023-2024.xls]Competition Draw'!$I$250 -> . | AA64: ='[Competition_Program 2023-2024.xls]Competition Draw'!$K$250 -> . | AC64: vs | AI64: ='[Competition_Program 2023-2024.xls]Competition Draw'!$I$221 -> . | AJ64: ='[Competition_Program 2023-2024.xls]Competition Draw'!$K$221 -> . | AL64: ='[Competition_Program 2023-2024.xls]Competition Draw'!$E$206 -> . | AM64: ='[Competition_Program 2023-2024.xls]Competition Draw'!$G$206 -> .
B65: ='[Competition_Program 2023-2024.xls]Competition Draw'!$F$198 -> . | E65: ='[Competition_Program 2023-2024.xls]Competition Draw'!$J$213 -> . | N65: ='[Competition_Program 2023-2024.xls]Competition Draw'!$J$248 -> . | Z65: ='[Competition_Program 2023-2024.xls]Competition Draw'!$J$250 -> . | AI65: ='[Competition_Program 2023-2024.xls]Competition Draw'!$J$221 -> . | AL65: ='[Competition_Program 2023-2024.xls]Competition Draw'!$F$206 -> .
B66: vs | H66: ='[Competition_Program 2023-2024.xls]Competition Draw'!$E$230 -> McCague, Hugh | I66: ='[Competition_Program 2023-2024.xls]Competition Draw'!$G$230 -> 19 | AF66: ='[Competition_Program 2023-2024.xls]Competition Draw'!$E$238 -> Clarke, Andy | AG66: ='[Competition_Program 2023-2024.xls]Competition Draw'!$G$238 -> 4 | AL66: vs
H67: ='[Competition_Program 2023-2024.xls]Competition Draw'!$F$230 -> Skeggs, David | AF67: ='[Competition_Program 2023-2024.xls]Competition Draw'!$F$238 -> Pond, Callum
B68: ='[Competition_Program 2023-2024.xls]Competition Draw'!$I$198 -> . | C68: ='[Competition_Program 2023-2024.xls]Competition Draw'!$K$198 -> . | E68: ='[Competition_Program 2023-2024.xls]Competition Draw'!$E$214 -> . | F68: ='[Competition_Program 2023-2024.xls]Competition Draw'!$G$214 -> . | H68: vs | K68: ='[Competition_Program 2023-2024.xls]Competition Draw'!$I$242 -> . | L68: ='[Competition_Program 2023-2024.xls]Competition Draw'!$K$242 -> . | AC68: ='[Competition_Program 2023-2024.xls]Competition Draw'!$I$246 -> . | AD68: ='[Competition_Program 2023-2024.xls]Competition Draw'!$K$246 -> . | AF68: vs | AI68: ='[Competition_Program 2023-2024.xls]Competition Draw'!$E$222 -> . | AJ68: ='[Competition_Program 2023-2024.xls]Competition Draw'!$G$222 -> . | AL68: ='[Competition_Program 2023-2024.xls]Competition Draw'!$I$206 -> . | AM68: ='[Competition_Program 2023-2024.xls]Competition Draw'!$K$206 -> .
B69: ='[Competition_Program 2023-2024.xls]Competition Draw'!$J$198 -> . | E69: ='[Competition_Program 2023-2024.xls]Competition Draw'!$F$214 -> . | K69: ='[Competition_Program 2023-2024.xls]Competition Draw'!$J$242 -> . | AC69: ='[Competition_Program 2023-2024.xls]Competition Draw'!$J$246 -> . | AI69: ='[Competition_Program 2023-2024.xls]Competition Draw'!$F$222 -> . | AL69: ='[Competition_Program 2023-2024.xls]Competition Draw'!$J$206 -> .
E70: vs | H70: ='[Competition_Program 2023-2024.xls]Competition Draw'!$I$230 -> Bunney, David | I70: ='[Competition_Program 2023-2024.xls]Competition Draw'!$K$230 -> 5 | AF70: ='[Competition_Program 2023-2024.xls]Competition Draw'!$I$238 -> Dimaio, Rino | AG70: ='[Competition_Program 2023-2024.xls]Competition Draw'!$K$238 -> 10 | AI70: vs
H71: ='[Competition_Program 2023-2024.xls]Competition Draw'!$J$230 -> Harding, Ricky | AF71: ='[Competition_Program 2023-2024.xls]Competition Draw'!$J$238 -> Peters, Peter
E72: ='[Competition_Program 2023-2024.xls]Competition Draw'!$I$214 -> . | F72: ='[Competition_Program 2023-2024.xls]Competition Draw'!$K$214 -> . | AI72: ='[Competition_Program 2023-2024.xls]Competition Draw'!$I$222 -> . | AJ72: ='[Competition_Program 2023-2024.xls]Competition Draw'!$K$222 -> .
E73: ='[Competition_Program 2023-2024.xls]Competition Draw'!$J$214 -> . | AI73: ='[Competition_Program 2023-2024.xls]Competition Draw'!$J$222 -> .
A74: Note : Name followed by an accent (^) , denotes that the player claimed the match and was awarded a win at a Committee meeting,
A75: Note: Name followed by an asterisk (*), denotes that the player has been awarded a 'win' by the toss of a coin at a Committee meeting