A2: WGC & District Billiards and Snooker League
A3: Snooker Doubles Championship
B5: =X5&"+" -> Round 1+ | D5: ='[Competition_Program 2023-2024.xls]Run Program'!$C$9 -> Round 1 | F5: ='[Competition_Program 2023-2024.xls]Run Program'!$C$10 -> Round 2 | H5: ='[Competition_Program 2023-2024.xls]Run Program'!$C$11 -> Round 3 | J5: ='[Competition_Program 2023-2024.xls]Run Program'!$C$12 -> Quarter Final | L5: ='[Competition_Program 2023-2024.xls]Run Program'!$C$13 -> Semi Final | N5: ='[Competition_Program 2023-2024.xls]Run Program'!$C$14 -> Final | P5: ='[Competition_Program 2023-2024.xls]Run Program'!$C$13 -> Semi Final | R5: ='[Competition_Program 2023-2024.xls]Run Program'!$C$12 -> Quarter Final | T5: ='[Competition_Program 2023-2024.xls]Run Program'!$C$11 -> Round 3 | V5: ='[Competition_Program 2023-2024.xls]Run Program'!$C$10 -> Round 2 | X5: ='[Competition_Program 2023-2024.xls]Run Program'!$C$9 -> Round 1 | Z5: =X5&"+" -> Round 1+
D6: Play by | F6: Play by | H6: Play by | J6: Play by | L6: Play By | N6: Play By | P6: Play By | R6: Play by | T6: Play by | V6: Play by | X6: Play by
D7: ='[Competition_Program 2023-2024.xls]Run Program'!$D$9 -> 45228 | F7: ='[Competition_Program 2023-2024.xls]Run Program'!$D$10 -> 45263 | H7: ='[Competition_Program 2023-2024.xls]Run Program'!$D$11 -> 45319 | J7: ='[Competition_Program 2023-2024.xls]Run Program'!$D$12 -> 45354 | L7: ='[Competition_Program 2023-2024.xls]Run Program'!$D$13 -> 45379 | N7: ='[Competition_Program 2023-2024.xls]Run Program'!$D$14 -> 45410 | P7: ='[Competition_Program 2023-2024.xls]Run Program'!$D$13 -> 45379 | R7: ='[Competition_Program 2023-2024.xls]Run Program'!$D$12 -> 45354 | T7: ='[Competition_Program 2023-2024.xls]Run Program'!$D$11 -> 45319 | V7: ='[Competition_Program 2023-2024.xls]Run Program'!$D$10 -> 45263 | X7: ='[Competition_Program 2023-2024.xls]Run Program'!$D$9 -> 45228
B8: ='[Competition_Program 2023-2024.xls]Competition Draw'!$E$128 -> . | D8: ='[Competition_Program 2023-2024.xls]Run Program'!$M$9 -> Best of 3 | F8: ='[Competition_Program 2023-2024.xls]Run Program'!$M$11 -> Best of 3 | H8: ='[Competition_Program 2023-2024.xls]Run Program'!$M$13 -> Best of 3 | J8: ='[Competition_Program 2023-2024.xls]Run Program'!$M$15 -> Best of 3 | L8: ='[Competition_Program 2023-2024.xls]Run Program'!$M$17 -> Best of 3 | N8: ='[Competition_Program 2023-2024.xls]Run Program'!$M$19 -> Best of 5 | P8: ='[Competition_Program 2023-2024.xls]Run Program'!$M$21 -> Best of 3 | R8: ='[Competition_Program 2023-2024.xls]Run Program'!$M$23 -> Best of 3 | T8: ='[Competition_Program 2023-2024.xls]Run Program'!$M$25 -> Best of 3 | V8: ='[Competition_Program 2023-2024.xls]Run Program'!$M$27 -> Best of 3 | X8: ='[Competition_Program 2023-2024.xls]Run Program'!$M$29 -> Best of 3 | Z8: ='[Competition_Program 2023-2024.xls]Competition Draw'!$E$136 -> .
B9: ='[Competition_Program 2023-2024.xls]Competition Draw'!$F$128 -> . | Z9: ='[Competition_Program 2023-2024.xls]Competition Draw'!$F$136 -> .
B10: vs | F10: ='[Competition_Program 2023-2024.xls]Competition Draw'!$E$160 -> Doocey, Liam | V10: ='[Competition_Program 2023-2024.xls]Competition Draw'!$E$168 -> . | Z10: vs
F11: ='[Competition_Program 2023-2024.xls]Competition Draw'!$F$160 -> Herdman, Andy | V11: ='[Competition_Program 2023-2024.xls]Competition Draw'!$F$168 -> .
B12: ='[Competition_Program 2023-2024.xls]Competition Draw'!$I$128 -> . | D12: ='[Competition_Program 2023-2024.xls]Competition Draw'!$E$144 -> . | F12: vs | H12: ='[Competition_Program 2023-2024.xls]Competition Draw'!$E$176 -> . | T12: ='[Competition_Program 2023-2024.xls]Competition Draw'!$E$180 -> O'Connor, Paul | V12: vs | X12: ='[Competition_Program 2023-2024.xls]Competition Draw'!$E$152 -> . | Z12: ='[Competition_Program 2023-2024.xls]Competition Draw'!$I$136 -> .
B13: ='[Competition_Program 2023-2024.xls]Competition Draw'!$J$128 -> . | D13: ='[Competition_Program 2023-2024.xls]Competition Draw'!$F$144 -> . | H13: ='[Competition_Program 2023-2024.xls]Competition Draw'!$F$176 -> . | T13: ='[Competition_Program 2023-2024.xls]Competition Draw'!$F$180 -> O'Connor, Rory | X13: ='[Competition_Program 2023-2024.xls]Competition Draw'!$F$152 -> . | Z13: ='[Competition_Program 2023-2024.xls]Competition Draw'!$J$136 -> .
D14: vs | F14: ='[Competition_Program 2023-2024.xls]Competition Draw'!$I$160 -> Lampey, Robert | V14: ='[Competition_Program 2023-2024.xls]Competition Draw'!$I$168 -> . | X14: vs
F15: ='[Competition_Program 2023-2024.xls]Competition Draw'!$J$160 -> Smith, Sid | V15: ='[Competition_Program 2023-2024.xls]Competition Draw'!$J$168 -> .
B16: ='[Competition_Program 2023-2024.xls]Competition Draw'!$E$129 -> . | D16: ='[Competition_Program 2023-2024.xls]Competition Draw'!$I$144 -> . | H16: vs | J16: ='[Competition_Program 2023-2024.xls]Competition Draw'!$E$184 -> . | R16: ='[Competition_Program 2023-2024.xls]Competition Draw'!$E$186 -> . | T16: vs | X16: ='[Competition_Program 2023-2024.xls]Competition Draw'!$I$152 -> . | Z16: ='[Competition_Program 2023-2024.xls]Competition Draw'!$E$137 -> .
B17: ='[Competition_Program 2023-2024.xls]Competition Draw'!$F$129 -> . | D17: ='[Competition_Program 2023-2024.xls]Competition Draw'!$J$144 -> . | J17: ='[Competition_Program 2023-2024.xls]Competition Draw'!$F$184 -> . | R17: ='[Competition_Program 2023-2024.xls]Competition Draw'!$F$186 -> . | X17: ='[Competition_Program 2023-2024.xls]Competition Draw'!$J$152 -> . | Z17: ='[Competition_Program 2023-2024.xls]Competition Draw'!$F$137 -> .
B18: vs | F18: ='[Competition_Program 2023-2024.xls]Competition Draw'!$E$161 -> Lightfoot, Neil | V18: ='[Competition_Program 2023-2024.xls]Competition Draw'!$E$169 -> . | Z18: vs
F19: ='[Competition_Program 2023-2024.xls]Competition Draw'!$F$161 -> Tehrani, Ali | V19: ='[Competition_Program 2023-2024.xls]Competition Draw'!$F$169 -> .
B20: ='[Competition_Program 2023-2024.xls]Competition Draw'!$I$129 -> . | D20: ='[Competition_Program 2023-2024.xls]Competition Draw'!$E$145 -> . | F20: vs | H20: ='[Competition_Program 2023-2024.xls]Competition Draw'!$I$176 -> . | T20: ='[Competition_Program 2023-2024.xls]Competition Draw'!$I$180 -> Andrews, Michael | V20: vs | X20: ='[Competition_Program 2023-2024.xls]Competition Draw'!$E$153 -> . | Z20: ='[Competition_Program 2023-2024.xls]Competition Draw'!$I$137 -> .
B21: ='[Competition_Program 2023-2024.xls]Competition Draw'!$J$129 -> . | D21: ='[Competition_Program 2023-2024.xls]Competition Draw'!$F$145 -> . | H21: ='[Competition_Program 2023-2024.xls]Competition Draw'!$J$176 -> . | T21: ='[Competition_Program 2023-2024.xls]Competition Draw'!$J$180 -> Andrews, Stephen | X21: ='[Competition_Program 2023-2024.xls]Competition Draw'!$F$153 -> . | Z21: ='[Competition_Program 2023-2024.xls]Competition Draw'!$J$137 -> .
D22: vs | F22: ='[Competition_Program 2023-2024.xls]Competition Draw'!$I$161 -> Ebbs, John | V22: ='[Competition_Program 2023-2024.xls]Competition Draw'!$I$169 -> . | X22: vs
F23: ='[Competition_Program 2023-2024.xls]Competition Draw'!$J$161 -> Grainger, Martin | V23: ='[Competition_Program 2023-2024.xls]Competition Draw'!$J$169 -> .
B24: ='[Competition_Program 2023-2024.xls]Competition Draw'!$E$130 -> . | D24: ='[Competition_Program 2023-2024.xls]Competition Draw'!$I$145 -> . | J24: vs | L24: ='[Competition_Program 2023-2024.xls]Competition Draw'!$E$188 -> . | P24: ='[Competition_Program 2023-2024.xls]Competition Draw'!$E$189 -> . | R24: vs | X24: ='[Competition_Program 2023-2024.xls]Competition Draw'!$I$153 -> . | Z24: ='[Competition_Program 2023-2024.xls]Competition Draw'!$E$138 -> .
B25: ='[Competition_Program 2023-2024.xls]Competition Draw'!$F$130 -> . | D25: ='[Competition_Program 2023-2024.xls]Competition Draw'!$J$145 -> . | L25: ='[Competition_Program 2023-2024.xls]Competition Draw'!$F$188 -> . | P25: ='[Competition_Program 2023-2024.xls]Competition Draw'!$F$189 -> . | X25: ='[Competition_Program 2023-2024.xls]Competition Draw'!$J$153 -> . | Z25: ='[Competition_Program 2023-2024.xls]Competition Draw'!$F$138 -> .
B26: vs | F26: ='[Competition_Program 2023-2024.xls]Competition Draw'!$E$162 -> . | V26: ='[Competition_Program 2023-2024.xls]Competition Draw'!$E$170 -> . | Z26: vs
F27: ='[Competition_Program 2023-2024.xls]Competition Draw'!$F$162 -> . | V27: ='[Competition_Program 2023-2024.xls]Competition Draw'!$F$170 -> .
B28: ='[Competition_Program 2023-2024.xls]Competition Draw'!$I$130 -> . | D28: ='[Competition_Program 2023-2024.xls]Competition Draw'!$E$146 -> . | F28: vs | H28: ='[Competition_Program 2023-2024.xls]Competition Draw'!$E$177 -> Motekhasses, Bijan | T28: ='[Competition_Program 2023-2024.xls]Competition Draw'!$E$181 -> Gibbs, Steve | V28: vs | X28: ='[Competition_Program 2023-2024.xls]Competition Draw'!$E$154 -> . | Z28: ='[Competition_Program 2023-2024.xls]Competition Draw'!$I$138 -> .
B29: ='[Competition_Program 2023-2024.xls]Competition Draw'!$J$130 -> . | D29: ='[Competition_Program 2023-2024.xls]Competition Draw'!$F$146 -> . | H29: ='[Competition_Program 2023-2024.xls]Competition Draw'!$F$177 -> Payne, Mark | T29: ='[Competition_Program 2023-2024.xls]Competition Draw'!$F$181 -> Powell, Rob | X29: ='[Competition_Program 2023-2024.xls]Competition Draw'!$F$154 -> . | Z29: ='[Competition_Program 2023-2024.xls]Competition Draw'!$J$138 -> .
D30: vs | F30: ='[Competition_Program 2023-2024.xls]Competition Draw'!$I$162 -> . | V30: ='[Competition_Program 2023-2024.xls]Competition Draw'!$I$170 -> . | X30: vs
F31: ='[Competition_Program 2023-2024.xls]Competition Draw'!$J$162 -> . | V31: ='[Competition_Program 2023-2024.xls]Competition Draw'!$J$170 -> .
B32: ='[Competition_Program 2023-2024.xls]Competition Draw'!$E$131 -> . | D32: ='[Competition_Program 2023-2024.xls]Competition Draw'!$I$146 -> . | H32: vs | J32: ='[Competition_Program 2023-2024.xls]Competition Draw'!$I$184 -> . | R32: ='[Competition_Program 2023-2024.xls]Competition Draw'!$I$186 -> . | T32: vs | X32: ='[Competition_Program 2023-2024.xls]Competition Draw'!$I$154 -> . | Z32: ='[Competition_Program 2023-2024.xls]Competition Draw'!$E$139 -> .
B33: ='[Competition_Program 2023-2024.xls]Competition Draw'!$F$131 -> . | D33: ='[Competition_Program 2023-2024.xls]Competition Draw'!$J$146 -> . | J33: ='[Competition_Program 2023-2024.xls]Competition Draw'!$J$184 -> . | R33: ='[Competition_Program 2023-2024.xls]Competition Draw'!$J$186 -> . | X33: ='[Competition_Program 2023-2024.xls]Competition Draw'!$J$154 -> . | Z33: ='[Competition_Program 2023-2024.xls]Competition Draw'!$F$139 -> .
B34: vs | F34: ='[Competition_Program 2023-2024.xls]Competition Draw'!$E$163 -> . | V34: ='[Competition_Program 2023-2024.xls]Competition Draw'!$E$171 -> Howe, Grahame | Z34: vs
F35: ='[Competition_Program 2023-2024.xls]Competition Draw'!$F$163 -> . | V35: ='[Competition_Program 2023-2024.xls]Competition Draw'!$F$171 -> Kightley, Oliver
B36: ='[Competition_Program 2023-2024.xls]Competition Draw'!$I$131 -> . | D36: ='[Competition_Program 2023-2024.xls]Competition Draw'!$E$147 -> . | F36: vs | H36: ='[Competition_Program 2023-2024.xls]Competition Draw'!$I$177 -> Deo, Satnam | N36: ='[Competition_Program 2023-2024.xls]Competition Draw'!$E$190 -> . | T36: ='[Competition_Program 2023-2024.xls]Competition Draw'!$I$181 -> . | V36: vs | X36: ='[Competition_Program 2023-2024.xls]Competition Draw'!$E$155 -> . | Z36: ='[Competition_Program 2023-2024.xls]Competition Draw'!$I$139 -> .
B37: ='[Competition_Program 2023-2024.xls]Competition Draw'!$J$131 -> . | D37: ='[Competition_Program 2023-2024.xls]Competition Draw'!$F$147 -> . | H37: ='[Competition_Program 2023-2024.xls]Competition Draw'!$J$177 -> Sachs, Kim | N37: ='[Competition_Program 2023-2024.xls]Competition Draw'!$F$190 -> . | T37: ='[Competition_Program 2023-2024.xls]Competition Draw'!$J$181 -> . | X37: ='[Competition_Program 2023-2024.xls]Competition Draw'!$F$155 -> . | Z37: ='[Competition_Program 2023-2024.xls]Competition Draw'!$J$139 -> .
D38: vs | F38: ='[Competition_Program 2023-2024.xls]Competition Draw'!$I$163 -> . | V38: ='[Competition_Program 2023-2024.xls]Competition Draw'!$I$171 -> Currie, Steve | X38: vs
F39: ='[Competition_Program 2023-2024.xls]Competition Draw'!$J$163 -> . | N39: Winners | V39: ='[Competition_Program 2023-2024.xls]Competition Draw'!$J$171 -> Hilborne, Steve
B40: ='[Competition_Program 2023-2024.xls]Competition Draw'!$E$132 -> . | D40: ='[Competition_Program 2023-2024.xls]Competition Draw'!$I$147 -> . | L40: vs | N40: ='[Competition_Program 2023-2024.xls]Competition Draw'!$M$190 -> . | P40: vs | X40: ='[Competition_Program 2023-2024.xls]Competition Draw'!$I$155 -> . | Z40: ='[Competition_Program 2023-2024.xls]Competition Draw'!$E$140 -> .
B41: ='[Competition_Program 2023-2024.xls]Competition Draw'!$F$132 -> . | D41: ='[Competition_Program 2023-2024.xls]Competition Draw'!$J$147 -> . | N41: ='[Competition_Program 2023-2024.xls]Competition Draw'!$N$190 -> . | X41: ='[Competition_Program 2023-2024.xls]Competition Draw'!$J$155 -> . | Z41: ='[Competition_Program 2023-2024.xls]Competition Draw'!$F$140 -> .
B42: vs | F42: ='[Competition_Program 2023-2024.xls]Competition Draw'!$E$164 -> . | V42: ='[Competition_Program 2023-2024.xls]Competition Draw'!$E$172 -> . | Z42: vs
F43: ='[Competition_Program 2023-2024.xls]Competition Draw'!$F$164 -> . | V43: ='[Competition_Program 2023-2024.xls]Competition Draw'!$F$172 -> .
B44: ='[Competition_Program 2023-2024.xls]Competition Draw'!$I$132 -> . | D44: ='[Competition_Program 2023-2024.xls]Competition Draw'!$E$148 -> . | F44: vs | H44: ='[Competition_Program 2023-2024.xls]Competition Draw'!$E$178 -> Grant, Paul | N44: ='[Competition_Program 2023-2024.xls]Competition Draw'!$I$190 -> . | T44: ='[Competition_Program 2023-2024.xls]Competition Draw'!$E$182 -> Cartwright, Bob | V44: vs | X44: ='[Competition_Program 2023-2024.xls]Competition Draw'!$E$156 -> . | Z44: ='[Competition_Program 2023-2024.xls]Competition Draw'!$I$140 -> .
B45: ='[Competition_Program 2023-2024.xls]Competition Draw'!$J$132 -> . | D45: ='[Competition_Program 2023-2024.xls]Competition Draw'!$F$148 -> . | H45: ='[Competition_Program 2023-2024.xls]Competition Draw'!$F$178 -> Locke, Mike | N45: ='[Competition_Program 2023-2024.xls]Competition Draw'!$J$190 -> . | T45: ='[Competition_Program 2023-2024.xls]Competition Draw'!$F$182 -> Marchese, Joe | X45: ='[Competition_Program 2023-2024.xls]Competition Draw'!$F$156 -> . | Z45: ='[Competition_Program 2023-2024.xls]Competition Draw'!$J$140 -> .
D46: vs | F46: ='[Competition_Program 2023-2024.xls]Competition Draw'!$I$164 -> . | V46: ='[Competition_Program 2023-2024.xls]Competition Draw'!$I$172 -> . | X46: vs
F47: ='[Competition_Program 2023-2024.xls]Competition Draw'!$J$164 -> . | V47: ='[Competition_Program 2023-2024.xls]Competition Draw'!$J$172 -> .
B48: ='[Competition_Program 2023-2024.xls]Competition Draw'!$E$133 -> . | D48: ='[Competition_Program 2023-2024.xls]Competition Draw'!$I$148 -> . | H48: vs | J48: ='[Competition_Program 2023-2024.xls]Competition Draw'!$E$185 -> . | R48: ='[Competition_Program 2023-2024.xls]Competition Draw'!$E$187 -> . | T48: vs | X48: ='[Competition_Program 2023-2024.xls]Competition Draw'!$I$156 -> . | Z48: ='[Competition_Program 2023-2024.xls]Competition Draw'!$E$141 -> .
B49: ='[Competition_Program 2023-2024.xls]Competition Draw'!$F$133 -> . | D49: ='[Competition_Program 2023-2024.xls]Competition Draw'!$J$148 -> . | J49: ='[Competition_Program 2023-2024.xls]Competition Draw'!$F$185 -> . | R49: ='[Competition_Program 2023-2024.xls]Competition Draw'!$F$187 -> . | X49: ='[Competition_Program 2023-2024.xls]Competition Draw'!$J$156 -> . | Z49: ='[Competition_Program 2023-2024.xls]Competition Draw'!$F$141 -> .
B50: vs | F50: ='[Competition_Program 2023-2024.xls]Competition Draw'!$E$165 -> . | V50: ='[Competition_Program 2023-2024.xls]Competition Draw'!$E$173 -> . | Z50: vs
F51: ='[Competition_Program 2023-2024.xls]Competition Draw'!$F$165 -> . | V51: ='[Competition_Program 2023-2024.xls]Competition Draw'!$F$173 -> .
B52: ='[Competition_Program 2023-2024.xls]Competition Draw'!$I$133 -> . | D52: ='[Competition_Program 2023-2024.xls]Competition Draw'!$E$149 -> . | F52: vs | H52: ='[Competition_Program 2023-2024.xls]Competition Draw'!$I$178 -> Read, Dave | T52: ='[Competition_Program 2023-2024.xls]Competition Draw'!$I$182 -> Elias, Iyad | V52: vs | X52: ='[Competition_Program 2023-2024.xls]Competition Draw'!$E$157 -> . | Z52: ='[Competition_Program 2023-2024.xls]Competition Draw'!$I$141 -> .
B53: ='[Competition_Program 2023-2024.xls]Competition Draw'!$J$133 -> . | D53: ='[Competition_Program 2023-2024.xls]Competition Draw'!$F$149 -> . | H53: ='[Competition_Program 2023-2024.xls]Competition Draw'!$J$178 -> Reade, Liam | T53: ='[Competition_Program 2023-2024.xls]Competition Draw'!$J$182 -> Miller, Stephen | X53: ='[Competition_Program 2023-2024.xls]Competition Draw'!$F$157 -> . | Z53: ='[Competition_Program 2023-2024.xls]Competition Draw'!$J$141 -> .
D54: vs | F54: ='[Competition_Program 2023-2024.xls]Competition Draw'!$I$165 -> . | V54: ='[Competition_Program 2023-2024.xls]Competition Draw'!$I$173 -> . | X54: vs
F55: ='[Competition_Program 2023-2024.xls]Competition Draw'!$J$165 -> . | V55: ='[Competition_Program 2023-2024.xls]Competition Draw'!$J$173 -> .
B56: ='[Competition_Program 2023-2024.xls]Competition Draw'!$E$134 -> . | D56: ='[Competition_Program 2023-2024.xls]Competition Draw'!$I$149 -> . | J56: vs | L56: ='[Competition_Program 2023-2024.xls]Competition Draw'!$I$188 -> . | P56: ='[Competition_Program 2023-2024.xls]Competition Draw'!$I$189 -> . | R56: vs | X56: ='[Competition_Program 2023-2024.xls]Competition Draw'!$I$157 -> . | Z56: ='[Competition_Program 2023-2024.xls]Competition Draw'!$E$142 -> .
B57: ='[Competition_Program 2023-2024.xls]Competition Draw'!$F$134 -> . | D57: ='[Competition_Program 2023-2024.xls]Competition Draw'!$J$149 -> . | L57: ='[Competition_Program 2023-2024.xls]Competition Draw'!$J$188 -> . | P57: ='[Competition_Program 2023-2024.xls]Competition Draw'!$J$189 -> . | X57: ='[Competition_Program 2023-2024.xls]Competition Draw'!$J$157 -> . | Z57: ='[Competition_Program 2023-2024.xls]Competition Draw'!$F$142 -> .
B58: vs | F58: ='[Competition_Program 2023-2024.xls]Competition Draw'!$E$166 -> . | V58: ='[Competition_Program 2023-2024.xls]Competition Draw'!$E$174 -> . | Z58: vs
F59: ='[Competition_Program 2023-2024.xls]Competition Draw'!$F$166 -> . | V59: ='[Competition_Program 2023-2024.xls]Competition Draw'!$F$174 -> .
B60: ='[Competition_Program 2023-2024.xls]Competition Draw'!$I$134 -> . | D60: ='[Competition_Program 2023-2024.xls]Competition Draw'!$E$150 -> . | F60: vs | H60: ='[Competition_Program 2023-2024.xls]Competition Draw'!$E$179 -> Clarke, Andy | T60: ='[Competition_Program 2023-2024.xls]Competition Draw'!$E$183 -> Paterson-Proto, Jordan | X60: ='[Competition_Program 2023-2024.xls]Competition Draw'!$E$158 -> . | Z60: ='[Competition_Program 2023-2024.xls]Competition Draw'!$I$142 -> .
B61: ='[Competition_Program 2023-2024.xls]Competition Draw'!$J$134 -> . | D61: ='[Competition_Program 2023-2024.xls]Competition Draw'!$F$150 -> . | H61: ='[Competition_Program 2023-2024.xls]Competition Draw'!$F$179 -> Pond, Callum | T61: ='[Competition_Program 2023-2024.xls]Competition Draw'!$F$183 -> Pilborough, Mark | X61: ='[Competition_Program 2023-2024.xls]Competition Draw'!$F$158 -> . | Z61: ='[Competition_Program 2023-2024.xls]Competition Draw'!$J$142 -> .
D62: vs | F62: ='[Competition_Program 2023-2024.xls]Competition Draw'!$I$166 -> . | V62: ='[Competition_Program 2023-2024.xls]Competition Draw'!$I$174 -> . | X62: vs
F63: ='[Competition_Program 2023-2024.xls]Competition Draw'!$J$166 -> . | V63: ='[Competition_Program 2023-2024.xls]Competition Draw'!$J$174 -> .
B64: ='[Competition_Program 2023-2024.xls]Competition Draw'!$E$135 -> . | D64: ='[Competition_Program 2023-2024.xls]Competition Draw'!$I$150 -> . | H64: vs | J64: ='[Competition_Program 2023-2024.xls]Competition Draw'!$I$185 -> . | R64: ='[Competition_Program 2023-2024.xls]Competition Draw'!$I$187 -> . | T64: vs | X64: ='[Competition_Program 2023-2024.xls]Competition Draw'!$I$158 -> . | Z64: ='[Competition_Program 2023-2024.xls]Competition Draw'!$E$143 -> .
B65: ='[Competition_Program 2023-2024.xls]Competition Draw'!$F$135 -> . | D65: ='[Competition_Program 2023-2024.xls]Competition Draw'!$J$150 -> . | J65: ='[Competition_Program 2023-2024.xls]Competition Draw'!$J$185 -> . | R65: ='[Competition_Program 2023-2024.xls]Competition Draw'!$J$187 -> . | X65: ='[Competition_Program 2023-2024.xls]Competition Draw'!$J$158 -> . | Z65: ='[Competition_Program 2023-2024.xls]Competition Draw'!$F$143 -> .
B66: vs | F66: ='[Competition_Program 2023-2024.xls]Competition Draw'!$E$167 -> . | V66: ='[Competition_Program 2023-2024.xls]Competition Draw'!$E$175 -> Shaw, Benjamin | Z66: vs
F67: ='[Competition_Program 2023-2024.xls]Competition Draw'!$F$167 -> . | V67: ='[Competition_Program 2023-2024.xls]Competition Draw'!$F$175 -> Merrifield, Philip
B68: ='[Competition_Program 2023-2024.xls]Competition Draw'!$I$135 -> . | D68: ='[Competition_Program 2023-2024.xls]Competition Draw'!$E$151 -> . | F68: vs | H68: ='[Competition_Program 2023-2024.xls]Competition Draw'!$I$179 -> Dimaio, Rino | T68: ='[Competition_Program 2023-2024.xls]Competition Draw'!$I$183 -> . | V68: vs | X68: ='[Competition_Program 2023-2024.xls]Competition Draw'!$E$159 -> . | Z68: ='[Competition_Program 2023-2024.xls]Competition Draw'!$I$143 -> .
B69: ='[Competition_Program 2023-2024.xls]Competition Draw'!$J$135 -> . | D69: ='[Competition_Program 2023-2024.xls]Competition Draw'!$F$151 -> . | H69: ='[Competition_Program 2023-2024.xls]Competition Draw'!$J$179 -> Peters, Peter | T69: ='[Competition_Program 2023-2024.xls]Competition Draw'!$J$183 -> . | X69: ='[Competition_Program 2023-2024.xls]Competition Draw'!$F$159 -> . | Z69: ='[Competition_Program 2023-2024.xls]Competition Draw'!$J$143 -> .
D70: vs | F70: ='[Competition_Program 2023-2024.xls]Competition Draw'!$I$167 -> . | V70: ='[Competition_Program 2023-2024.xls]Competition Draw'!$I$175 -> Hannibal, David | X70: vs
F71: ='[Competition_Program 2023-2024.xls]Competition Draw'!$J$167 -> . | V71: ='[Competition_Program 2023-2024.xls]Competition Draw'!$J$175 -> Tilson, Jem
D72: ='[Competition_Program 2023-2024.xls]Competition Draw'!$I$151 -> . | X72: ='[Competition_Program 2023-2024.xls]Competition Draw'!$I$159 -> .
D73: ='[Competition_Program 2023-2024.xls]Competition Draw'!$J$151 -> . | X73: ='[Competition_Program 2023-2024.xls]Competition Draw'!$J$159 -> .
A74: Note : Name followed by an accent (^) , denotes that the player claimed the match and was awarded a win at a Committee meeting,
A75: Note: Name followed by an asterisk (*), denotes that the player has been awarded a 'win' by the toss of a coin at a Committee meeting