A2: WGC & District Billiards and Snooker League
A3: Billiards Singles Championship
B5: =D5&"+" -> Round 1+ | D5: ='[Competition_Program 2023-2024.xls]Run Program'!$C$9 -> Round 1 | F5: ='[Competition_Program 2023-2024.xls]Run Program'!$C$10 -> Round 2 | H5: ='[Competition_Program 2023-2024.xls]Run Program'!$C$11 -> Round 3 | J5: ='[Competition_Program 2023-2024.xls]Run Program'!$C$12 -> Quarter Final | L5: ='[Competition_Program 2023-2024.xls]Run Program'!$C$13 -> Semi Final | N5: ='[Competition_Program 2023-2024.xls]Run Program'!$C$14 -> Final | P5: ='[Competition_Program 2023-2024.xls]Run Program'!$C$13 -> Semi Final | R5: ='[Competition_Program 2023-2024.xls]Run Program'!$C$12 -> Quarter Final | T5: ='[Competition_Program 2023-2024.xls]Run Program'!$C$11 -> Round 3 | V5: ='[Competition_Program 2023-2024.xls]Run Program'!$C$10 -> Round 2 | X5: ='[Competition_Program 2023-2024.xls]Run Program'!$C$9 -> Round 1 | Z5: =X5&"+" -> Round 1+
D6: Play by | F6: Play by | H6: Play by | J6: Play by | L6: Play by | N6: Play by | P6: Play by | R6: Play by | T6: Play by | V6: Play by | X6: Play by
D7: ='[Competition_Program 2023-2024.xls]Run Program'!$D$9 -> 45228 | F7: ='[Competition_Program 2023-2024.xls]Run Program'!$D$10 -> 45263 | H7: ='[Competition_Program 2023-2024.xls]Run Program'!$D$11 -> 45319 | J7: ='[Competition_Program 2023-2024.xls]Run Program'!$D$12 -> 45354 | L7: ='[Competition_Program 2023-2024.xls]Run Program'!$D$13 -> 45379 | N7: ='[Competition_Program 2023-2024.xls]Run Program'!$D$14 -> 45410 | P7: ='[Competition_Program 2023-2024.xls]Run Program'!$D$13 -> 45379 | R7: ='[Competition_Program 2023-2024.xls]Run Program'!$D$12 -> 45354 | T7: ='[Competition_Program 2023-2024.xls]Run Program'!$D$11 -> 45319 | V7: ='[Competition_Program 2023-2024.xls]Run Program'!$D$10 -> 45263 | X7: ='[Competition_Program 2023-2024.xls]Run Program'!$D$9 -> 45228
B8: ='[Competition_Program 2023-2024.xls]Competition Draw'!$E$254 -> . | D8: ='[Competition_Program 2023-2024.xls]Run Program'!$N$9 -> 200 Up | F8: ='[Competition_Program 2023-2024.xls]Run Program'!$N$11 -> 200 Up | H8: ='[Competition_Program 2023-2024.xls]Run Program'!$N$13 -> 200 Up | J8: ='[Competition_Program 2023-2024.xls]Run Program'!$N$15 -> 200 Up | L8: ='[Competition_Program 2023-2024.xls]Run Program'!$N$17 -> 300 Up | N8: ='[Competition_Program 2023-2024.xls]Run Program'!$N$19 -> 300 Up | P8: ='[Competition_Program 2023-2024.xls]Run Program'!$N$21 -> 300 Up | R8: ='[Competition_Program 2023-2024.xls]Run Program'!$N$23 -> 200 Up | T8: ='[Competition_Program 2023-2024.xls]Run Program'!$N$25 -> 200 Up | V8: ='[Competition_Program 2023-2024.xls]Run Program'!$N$27 -> 200 Up | X8: ='[Competition_Program 2023-2024.xls]Run Program'!$N$29 -> 200 Up | Z8: ='[Competition_Program 2023-2024.xls]Competition Draw'!$E$262 -> .
B10: vs | F10: ='[Competition_Program 2023-2024.xls]Competition Draw'!$E$286 -> Andrews, Michael | V10: ='[Competition_Program 2023-2024.xls]Competition Draw'!$E$294 -> . | Z10: vs
B12: ='[Competition_Program 2023-2024.xls]Competition Draw'!$I$254 -> . | D12: ='[Competition_Program 2023-2024.xls]Competition Draw'!$E$270 -> . | F12: vs | H12: ='[Competition_Program 2023-2024.xls]Competition Draw'!$E$302 -> Andrews, Michael | T12: ='[Competition_Program 2023-2024.xls]Competition Draw'!$E$306 -> Howe, David | V12: vs | X12: ='[Competition_Program 2023-2024.xls]Competition Draw'!$E$278 -> . | Z12: ='[Competition_Program 2023-2024.xls]Competition Draw'!$I$262 -> .
D14: vs | F14: ='[Competition_Program 2023-2024.xls]Competition Draw'!$I$286 -> Wong, Kit | V14: ='[Competition_Program 2023-2024.xls]Competition Draw'!$I$294 -> . | X14: vs
B16: ='[Competition_Program 2023-2024.xls]Competition Draw'!$E$255 -> . | D16: ='[Competition_Program 2023-2024.xls]Competition Draw'!$I$270 -> . | H16: vs | J16: ='[Competition_Program 2023-2024.xls]Competition Draw'!$E$310 -> . | R16: ='[Competition_Program 2023-2024.xls]Competition Draw'!$E$312 -> . | T16: vs | X16: ='[Competition_Program 2023-2024.xls]Competition Draw'!$I$278 -> . | Z16: ='[Competition_Program 2023-2024.xls]Competition Draw'!$E$263 -> .
B18: vs | F18: ='[Competition_Program 2023-2024.xls]Competition Draw'!$E$287 -> . | V18: ='[Competition_Program 2023-2024.xls]Competition Draw'!$E$295 -> . | Z18: vs
B20: ='[Competition_Program 2023-2024.xls]Competition Draw'!$I$255 -> . | D20: ='[Competition_Program 2023-2024.xls]Competition Draw'!$E$271 -> . | F20: vs | H20: ='[Competition_Program 2023-2024.xls]Competition Draw'!$I$302 -> Smith, Sid | T20: ='[Competition_Program 2023-2024.xls]Competition Draw'!$I$306 -> Elias, Iyad | V20: vs | X20: ='[Competition_Program 2023-2024.xls]Competition Draw'!$E$279 -> . | Z20: ='[Competition_Program 2023-2024.xls]Competition Draw'!$I$263 -> .
D22: vs | F22: ='[Competition_Program 2023-2024.xls]Competition Draw'!$I$287 -> . | V22: ='[Competition_Program 2023-2024.xls]Competition Draw'!$I$295 -> . | X22: vs
B24: ='[Competition_Program 2023-2024.xls]Competition Draw'!$E$256 -> . | D24: ='[Competition_Program 2023-2024.xls]Competition Draw'!$I$271 -> . | J24: vs | L24: ='[Competition_Program 2023-2024.xls]Competition Draw'!$E$314 -> . | P24: ='[Competition_Program 2023-2024.xls]Competition Draw'!$E$315 -> . | R24: vs | X24: ='[Competition_Program 2023-2024.xls]Competition Draw'!$I$279 -> . | Z24: ='[Competition_Program 2023-2024.xls]Competition Draw'!$E$264 -> .
B26: vs | F26: ='[Competition_Program 2023-2024.xls]Competition Draw'!$E$288 -> . | V26: ='[Competition_Program 2023-2024.xls]Competition Draw'!$E$296 -> . | Z26: vs
B28: ='[Competition_Program 2023-2024.xls]Competition Draw'!$I$256 -> . | D28: ='[Competition_Program 2023-2024.xls]Competition Draw'!$E$272 -> . | F28: vs | H28: ='[Competition_Program 2023-2024.xls]Competition Draw'!$E$303 -> Lynch, Sean | T28: ='[Competition_Program 2023-2024.xls]Competition Draw'!$E$307 -> Miller, Stephen | V28: vs | X28: ='[Competition_Program 2023-2024.xls]Competition Draw'!$E$280 -> . | Z28: ='[Competition_Program 2023-2024.xls]Competition Draw'!$I$264 -> .
D30: vs | F30: ='[Competition_Program 2023-2024.xls]Competition Draw'!$I$288 -> . | V30: ='[Competition_Program 2023-2024.xls]Competition Draw'!$I$296 -> . | X30: vs
B32: ='[Competition_Program 2023-2024.xls]Competition Draw'!$E$257 -> . | D32: ='[Competition_Program 2023-2024.xls]Competition Draw'!$I$272 -> . | H32: vs | J32: ='[Competition_Program 2023-2024.xls]Competition Draw'!$I$310 -> . | R32: ='[Competition_Program 2023-2024.xls]Competition Draw'!$I$312 -> . | T32: vs | X32: ='[Competition_Program 2023-2024.xls]Competition Draw'!$I$280 -> . | Z32: ='[Competition_Program 2023-2024.xls]Competition Draw'!$E$265 -> .
B34: vs | F34: ='[Competition_Program 2023-2024.xls]Competition Draw'!$E$289 -> . | V34: ='[Competition_Program 2023-2024.xls]Competition Draw'!$E$297 -> . | Z34: vs
B36: ='[Competition_Program 2023-2024.xls]Competition Draw'!$I$257 -> . | D36: ='[Competition_Program 2023-2024.xls]Competition Draw'!$E$273 -> . | F36: vs | H36: ='[Competition_Program 2023-2024.xls]Competition Draw'!$I$303 -> Smith, Steve | N36: ='[Competition_Program 2023-2024.xls]Competition Draw'!$E$316 -> . | T36: ='[Competition_Program 2023-2024.xls]Competition Draw'!$I$307 -> Gibbs, Steve | V36: vs | X36: ='[Competition_Program 2023-2024.xls]Competition Draw'!$E$281 -> . | Z36: ='[Competition_Program 2023-2024.xls]Competition Draw'!$I$265 -> .
D38: vs | F38: ='[Competition_Program 2023-2024.xls]Competition Draw'!$I$289 -> . | V38: ='[Competition_Program 2023-2024.xls]Competition Draw'!$I$297 -> . | X38: vs
N39: Winner
B40: ='[Competition_Program 2023-2024.xls]Competition Draw'!$E$258 -> . | D40: ='[Competition_Program 2023-2024.xls]Competition Draw'!$I$273 -> . | L40: vs | N40: ='[Competition_Program 2023-2024.xls]Competition Draw'!$M$316 -> . | P40: vs | X40: ='[Competition_Program 2023-2024.xls]Competition Draw'!$I$281 -> . | Z40: ='[Competition_Program 2023-2024.xls]Competition Draw'!$E$266 -> .
B42: vs | F42: ='[Competition_Program 2023-2024.xls]Competition Draw'!$E$290 -> . | V42: ='[Competition_Program 2023-2024.xls]Competition Draw'!$E$298 -> . | Z42: vs
B44: ='[Competition_Program 2023-2024.xls]Competition Draw'!$I$258 -> . | D44: ='[Competition_Program 2023-2024.xls]Competition Draw'!$E$274 -> . | F44: vs | H44: ='[Competition_Program 2023-2024.xls]Competition Draw'!$E$304 -> O'Connor, Rory | N44: ='[Competition_Program 2023-2024.xls]Competition Draw'!$I$316 -> . | T44: ='[Competition_Program 2023-2024.xls]Competition Draw'!$E$308 -> O'Connor, Paul | V44: vs | X44: ='[Competition_Program 2023-2024.xls]Competition Draw'!$E$282 -> . | Z44: ='[Competition_Program 2023-2024.xls]Competition Draw'!$I$266 -> .
D46: vs | F46: ='[Competition_Program 2023-2024.xls]Competition Draw'!$I$290 -> . | V46: ='[Competition_Program 2023-2024.xls]Competition Draw'!$I$298 -> . | X46: vs
B48: ='[Competition_Program 2023-2024.xls]Competition Draw'!$E$259 -> . | D48: ='[Competition_Program 2023-2024.xls]Competition Draw'!$I$274 -> . | H48: vs | J48: ='[Competition_Program 2023-2024.xls]Competition Draw'!$E$311 -> . | R48: ='[Competition_Program 2023-2024.xls]Competition Draw'!$E$313 -> . | X48: ='[Competition_Program 2023-2024.xls]Competition Draw'!$I$282 -> . | Z48: ='[Competition_Program 2023-2024.xls]Competition Draw'!$E$267 -> .
B50: vs | F50: ='[Competition_Program 2023-2024.xls]Competition Draw'!$E$291 -> . | V50: ='[Competition_Program 2023-2024.xls]Competition Draw'!$E$299 -> . | Z50: vs
B52: ='[Competition_Program 2023-2024.xls]Competition Draw'!$I$259 -> . | D52: ='[Competition_Program 2023-2024.xls]Competition Draw'!$E$275 -> . | F52: vs | H52: ='[Competition_Program 2023-2024.xls]Competition Draw'!$I$304 -> Trinder, Tony | T52: ='[Competition_Program 2023-2024.xls]Competition Draw'!$I$308 -> Batehup, Keith | V52: vs | X52: ='[Competition_Program 2023-2024.xls]Competition Draw'!$E$283 -> . | Z52: ='[Competition_Program 2023-2024.xls]Competition Draw'!$I$267 -> .
D54: vs | F54: ='[Competition_Program 2023-2024.xls]Competition Draw'!$I$291 -> . | V54: ='[Competition_Program 2023-2024.xls]Competition Draw'!$I$299 -> . | X54: vs
B56: ='[Competition_Program 2023-2024.xls]Competition Draw'!$E$260 -> . | D56: ='[Competition_Program 2023-2024.xls]Competition Draw'!$I$275 -> . | L56: ='[Competition_Program 2023-2024.xls]Competition Draw'!$I$314 -> . | P56: ='[Competition_Program 2023-2024.xls]Competition Draw'!$I$315 -> . | R56: vs | X56: ='[Competition_Program 2023-2024.xls]Competition Draw'!$I$283 -> . | Z56: ='[Competition_Program 2023-2024.xls]Competition Draw'!$E$268 -> .
B58: vs | F58: ='[Competition_Program 2023-2024.xls]Competition Draw'!$E$292 -> . | V58: ='[Competition_Program 2023-2024.xls]Competition Draw'!$E$300 -> . | Z58: vs
B60: ='[Competition_Program 2023-2024.xls]Competition Draw'!$I$260 -> . | D60: ='[Competition_Program 2023-2024.xls]Competition Draw'!$E$276 -> . | F60: vs | H60: ='[Competition_Program 2023-2024.xls]Competition Draw'!$E$305 -> Spinks, John | T60: ='[Competition_Program 2023-2024.xls]Competition Draw'!$E$309 -> Lampey, Robert | V60: vs | X60: ='[Competition_Program 2023-2024.xls]Competition Draw'!$E$284 -> . | Z60: ='[Competition_Program 2023-2024.xls]Competition Draw'!$I$268 -> .
D62: vs | F62: ='[Competition_Program 2023-2024.xls]Competition Draw'!$I$292 -> . | V62: ='[Competition_Program 2023-2024.xls]Competition Draw'!$I$300 -> . | X62: vs
B64: ='[Competition_Program 2023-2024.xls]Competition Draw'!$E$261 -> . | D64: ='[Competition_Program 2023-2024.xls]Competition Draw'!$I$276 -> . | H64: vs | J64: ='[Competition_Program 2023-2024.xls]Competition Draw'!$I$311 -> . | R64: ='[Competition_Program 2023-2024.xls]Competition Draw'!$I$313 -> . | T64: vs | X64: ='[Competition_Program 2023-2024.xls]Competition Draw'!$I$284 -> . | Z64: ='[Competition_Program 2023-2024.xls]Competition Draw'!$E$269 -> .
B66: vs | F66: ='[Competition_Program 2023-2024.xls]Competition Draw'!$E$293 -> . | V66: ='[Competition_Program 2023-2024.xls]Competition Draw'!$E$301 -> . | Z66: vs
B68: ='[Competition_Program 2023-2024.xls]Competition Draw'!$I$261 -> . | D68: ='[Competition_Program 2023-2024.xls]Competition Draw'!$E$277 -> . | F68: vs | H68: ='[Competition_Program 2023-2024.xls]Competition Draw'!$I$305 -> Poulter, Adrian | T68: ='[Competition_Program 2023-2024.xls]Competition Draw'!$I$309 -> Marchese, Joe | V68: vs | X68: ='[Competition_Program 2023-2024.xls]Competition Draw'!$E$285 -> . | Z68: ='[Competition_Program 2023-2024.xls]Competition Draw'!$I$269 -> .
D70: vs | F70: ='[Competition_Program 2023-2024.xls]Competition Draw'!$I$293 -> . | V70: ='[Competition_Program 2023-2024.xls]Competition Draw'!$I$301 -> . | X70: vs
D72: ='[Competition_Program 2023-2024.xls]Competition Draw'!$I$277 -> . | X72: ='[Competition_Program 2023-2024.xls]Competition Draw'!$I$285 -> .
A74: Note : Name followed by an accent (^) , denotes that the player claimed the match and was awarded a win at a Committee meeting,
A75: Note: Name followed by an asterisk (*), denotes that the player has been awarded a 'win' by the toss of a coin at a Committee meeting